,text,Radnja,Rezija,Gluma,Muzika,Opsti utisak film,Opsti utisak komentar,Specijalni efekti
0,"Film je užasan, realna ocena 2/10. Ako vam se gleda zabavan horor koji ismeva klišee pogledajte Detention.",None,None,None,None,Negative,None,None
2,Interesantan!,None,None,None,None,Positive,None,None
3,"Odličan film, odlična recenzija.",None,None,None,None,Positive,Positive,None
4,Treba dodati i fantastičnu muziku koja prati ceo film...,None,None,None,Positive,None,None,None
6,"Dobar film, vrlo dobar. Recenzija je sve objasnila. P.S. Ja bih samo dodao, još jedna potvrda one narodne, da su žene - nužno zlo. ;-)",None,None,None,None,Positive,None,None
10,meni je ovo super film s obzirom da nisam baš fan naučne fantastike ali je ovo dobro ostvarenje Šeron je sjajna naravno,None,None,Positive,None,Positive,None,None
12,sećam se ovog horora iz klinačkih dana... mnogo dobar..  pomahnitala pena.. tako su ga prevodili na vhs kasetama.. :),None,None,None,None,Positive,None,None
13,"Savršen film, opravdana 10ka. Mada mi je od pomenutog režisera draži ""There will be blood"".",None,None,None,None,Positive,None,None
14,sjaajan.. svaka preporuka i opravdana ocena 10/10...,None,None,None,None,Positive,None,None
15,"Vrhunski film, stvarno svaka čast! Reditelja za predsednika! Velemajstorski!",None,Positive,None,None,Positive,None,None
16,"Well said :-) Prelep film... slažem se, jedna od najboljih adaptacija. I glumačka postava je briljirala.",None,None,Positive,None,Positive,None,None
18,"Stvarno genijalno, odlično odrađeno! Svaka čast, genijalna gluma, kao da su klonovi! A o kampanjama, bilo kakvim, ne treba dodatno trošiti reči. Super film.",None,None,Positive,None,Positive,None,None
19,"Osuda Nikoline glume je krajnje neosnovana. Nije osnovni smisao filma prikazati nečiji naglasak, već ispričati priču o nečijem životu, a Nikol je svakako to učinila sa životom Marte Gelhorn. Pored toga, projekti poput ""Dogvila"" i ""Zečje jame"" se teško mogu smatrati pogrešnim.",None,None,None,None,None,Negative,None
20,"naravno da vam je ovaj film prosečan kad ga upoređujete sa dark knightom koji je po meni najbolji akcioni triler ikada, a u poređenju sa ostalim akcijama msm da je ovaj film fantastičan :)",None,None,None,None,Positive,None,None
21,"Napeto u nekim delovima, sa solidnom pričom, fenomenalnom glumom (favoriti: Hardi i Hatavej), fantastičnim epilogom... Ipak, kad se ceo film sagleda - ne ostavlja ni približan utisak kao što je bio slučaj sa prethodnim delom. Previše isforsirano i pomalo kritično za držanje pažnje u prvih sat vremena. 7.5/10",Neutral,None,Positive,None,Neutral,None,None
24,"Film je odličan, pogotovo kada se oba Dark nastavka gledaju u malim vremenskim intervalima.... Ne kapiram čemu korišćenje IMAX kamere, zašto onda nije koristio ceo film ili za samo određene scene, nego ide u cik cak fazonu što je meni krajnje iritantno.",None,None,None,None,Positive,None,None
27,"Moram da priznam da je meni bio poprilično nezanimljiv i spor, (posebno) kad se uporedi sa ""Mračnim vitezom"" a i ovako... No hard feelings... (za vas fanove)... A i kraj je predvidiv... ne znam nije ostavio utisak na mene...",None,None,None,None,Negative,None,None
28,"Iako dugo očekivan, film na kraju ipak nije ostavio utisak na mene. Prvih sat vremena je poprilično dosadan i neubedljiv, a druga polovina filma mi se čini kao prekomerni trud da se nadoknadi manjkavost prve polovine... Samo ću spomenuti kao i uvek odličnog Tom Hardy-ja, bravo i svaka čast!",None,None,Positive,None,Negative,None,None
31,Apsolutni klasik.,None,None,None,None,Positive,None,None
34,Baš sam skoro pogledao ovaj film.. onako nasumice iz direktorijuma ga izaberem a da prethodno nisam čitao nikakve recenzije i bio zaista prijatno iznenađen. Zaista jedan od boljih filmova koje sam odgledao u poslednje vreme. Za svaku preporuku!,None,None,None,None,Positive,None,None
35,Ovaj film obavezno gledam barem jednom godišnje. Savršen je.,None,None,None,None,Positive,None,None
36,"Super film, lagan i opuštajući! Odlično!",None,None,None,None,Positive,None,None
41,Film je odličan!!!,None,None,None,None,Positive,None,None
44,"Последњи РЕЦ ми изгледа као филм који је направљен да се попуне девизни рачуни на основу старе славе. Шалу на страну, филм није лош али није ни упола узбудљив и динамичан као прва два дела.",None,None,None,None,Neutral,None,None
47,"Ne zaboravimo i fantastičnu numeru koju izvodi Demijen Rajs, koja je na početku filma...",None,None,None,Positive,None,None,None
48,fantastična romantična drama!,None,None,None,None,Positive,None,None
49,ovaj film je za mene totalno razočarenje. toliko godina smo čekali na novog spajdermena i šta smo dobili jedan prosečan film.,None,None,None,None,Negative,None,None
51,"Retko se slažem ali u ovom slučaju se potpuno slažem sa tobom, smatram da je prvi Spajdermen mnogo emotivniji od ovog, a da ne pričam da je Vilijem Defo triput bolji negativac.",None,None,None,None,None,Positive,None
52,"Film me baš razočarao, očekivao sam puno a ništa, radnja je pravolinijska od početka se zna šta će se desiti na kraju, jedina dobar stvar je gluma ellen page i to je sve...",None,None,Positive,None,Negative,None,None
53,ne volim baš ovakvu vrstu filmova meni nije nešto posebno,None,None,None,None,Negative,None,None
54,ovaj film sam gledao ni sam ne znam koliko puta i mogu reći pravo remek delo.,None,None,None,None,Positive,None,None
56,Sve je rečeno što se trebalo reći o ovome filmu. Čista 10!,None,None,None,None,Positive,None,None
61,Vanvremenski film sa vanvremenskom porukom. Briljantno...,None,None,None,None,Positive,None,None
62,"U potpunosti se slažem sa tvojom recenzijom, remek delo šta drugo reći.",None,None,None,None,Positive,Positive,None
63,"Jedan od najboljih filmova ikad, kako mi je drago što se odradili recenziju!!!",None,None,None,None,Positive,None,None
64,Film je vrrrrhunski!,None,None,None,None,Positive,None,None
65,Čista 10-ka!! Jedan od retkih koji me je terao da iz petnih žila navijam za glavnog aktera do poslednjeg trenutka filma...,None,None,None,None,Positive,None,None
66,"E vala, sad ga pretera da je u top 10 najboljih filmova... Al dobro, ukusi su različiti... :)",None,None,None,None,None,Negative,None
68,molio bih recenziju filma čudotvorac sa Met Dejmonom i Denijem De Vitom u glavnim ulogama meni je film sjajan,None,None,None,None,Positive,None,None
69,"Ovo je ekstremno glup film! Volim horor, o Kopoli ne treba trošiti reči, ali ovo... kakvo razočaranje....",None,None,None,None,Negative,None,None
73,"Potpuno se slažem, zaista odličan film.",None,None,None,None,Positive,Positive,None
74,odličan film,None,None,None,None,Positive,None,None
75,ne znam. sve to stoji što je napisano ali film pati od kliše momenata koji su izgleda neizostavni. ja sam baš previše očekivao od ovog filma kada sam gledao nedavno a nisam toliko oduševljen.,None,None,None,None,Negative,None,None
77,"Najslabiji Momčilovićev film. Ideja kao što reče Uroš dobra, ali realizacija traljava. Pokušaj satirične komedije koja nije ni dovoljno satirična, a ni smešna, likovi tipski i površni. Sve u svemu slabo, moglo je to mnogo bolje.",None,None,None,None,Negative,None,None
78,"ipak je ovo Kojina uloga života. Dobar na nivou ideje, ali je u realizaciji malo omanuto. Primetno je da u nekim trenucima nije znao šta da uradi zbog uslovnosti jednog kadra. Ali film je snimljen i to je za svako poštovanje.",None,None,Negative,None,Positive,None,None
79,"Odličan film i odlična gluma Emira Hadžihafizbegovića i Radoslava Milenkovića. Naravno, sve pohvale i za ostalu glumačku ekipu, ali njih dvojica dominiraju.",None,None,None,None,Positive,None,None
84,"Odlična recenzija filma, Hvala.",None,None,None,None,None,Positive,None
85,"sasvim solidan triler, tom kruz na nivou kao i fox, preporuka",None,None,Positive,None,Positive,None,None
86,"Gledao sam poodavno, ali danas obnovio. Nema šta, Tom Kruz. Odličan triler.",None,None,None,None,Positive,None,None
87,Stvarno odličan film i vrlo zanimljiva radnja od mene ocena 9 :),Positive,None,None,None,Positive,None,None
88,Fenomenalno Bojane! Volim mnogo ovaj film i njih dve su fantastične.,None,None,None,None,Positive,None,None
90,"zaista zanimljivo gledište ljudske psihe u ovom filmu, poučan film... gluma ekstra (mada ja ne volim dede i babe u filmovima :p)",None,None,Positive,None,Neutral,None,None
92,Genijalno! Brutalno i genijalno! Odličan film.,None,None,None,None,Positive,None,None
93,Jedan od meni dražih filmova. A tek Filip Glas koji radi savršenu muziku. Hvala na izvrsnoj recenziji!,None,None,None,Positive,Positive,None,None
94,Pogledao sam ga sada na Cinema City-ju i meni je film samo OK. Ocena 6/10,None,None,None,None,Neutral,None,None
95,ne bi me začudilo da Meril Strip i ove godine dobije oskara,None,None,Positive,None,None,None,None
96,"Kao što rekoše u filmu, ""koliko je nevinost važna nevinim ljudima"". Teško je biti u njihovoj koži. A o glumi, već je sve objašnjeno. Vrh.",None,None,None,None,Positive,None,None
98,simpatičan film za pogledati sa društvom :) u nekim momentima baca na razmišljanje (ona fora na predavanju sa šansama...),None,None,None,None,Positive,None,None
99,"Simpatičan film, i sve što ide uz filmove te tematike. Solidan.",None,None,None,None,Positive,None,None
101,"ovaj film ne zaslužuje ocenu 4, osmica je previše dok mi je šestica opet preniska, mislim da barem zaslužuje 7, što se mene tiče ako hoćete da se odmorite od glupih i dosadnih američkih romansi, pogledajte ovu jer zaista pruža nešto bolje i novije",None,None,None,None,Positive,None,None
102,Odličan film! 8/10,None,None,None,None,Positive,None,None
103,"To stoji, samo što ovaj film baš i nije za poštovanje.",None,None,None,None,Negative,Positive,None
104,Ja bih ipak ukazao malo veći respekt Woody Allen-u.,None,Positive,None,None,None,None,None
105,Sve je u redu sa nama! Čitamo se :),None,None,None,None,None,Positive,None
107,voleo bih da neko uradi recenziju filma dnevnik jednog košarkaša sa Dicapriom u glavnoj ulozi jako težak film koji govori o narkomaniji Di Kaprio maestralno odglumio pored njega je naravno i Mark Volberg,None,None,Positive,None,None,None,None
108,"Leto, Jesen, Zima, Proleće, i ipak se okreće. Stalno u krug. Odličan film. Rizično, ali dobro odrađen film. U svim aspektima.",None,None,None,None,Positive,None,None
109,"jako retko gledam romanse, ali ovo je zaista bilo osveženje. realan prikaz jedne veze kroz nelinearnu priču i jaku glumu ostavlja dubok utisak",None,None,None,None,Positive,None,None
110,"Meni se baš dopao iz razloga što je drugačiji što dosta odudara od sličnih filmova. Sve pohvale za Laveta, dečko će tek pokazati svoj kvalitet.",None,None,None,None,Positive,None,None
111,dobar film ali ubedljivo najbolji džejms bond je Šon koneri,None,None,None,None,Positive,None,None
112,"ovo mi je prvi film iz 007 serijala. pristojan akcioni trilerčić, od mene 7 ipak za 8 treba malo originalnosti :)",None,None,None,None,Neutral,None,None
113,Baš tako! :),None,None,None,None,None,Positive,None
114,Dobri stari 007! Samo u novijem izdanju!,None,None,None,None,Positive,None,None
119,"Slažem se da su efekti fantastični, ali prosto mi je žao što je ubačen alien! Veliki sam fan Ridlija Skota, ali priča je imala veliki potencijal koji je loše iskorišćen...",None,None,None,None,Negative,Positive,Positive
120,"Film je vizuelno lep, ali inače loš. Ni prineti Alienu, pa ni drugom delu. Jednostavno, nešto mu fali da bude vrhunski. Priča je malo glupa, likovi su malo plitki, glumci su malo dosadni (sa izuzetkom robota). Mnogo hteo, mnogo započeo. Šteta.",Negative,None,Negative,None,Negative,None,None
123,Ridli Skot se vratio svom žanru. Odličan Ep o bogovima i ljudima :). Sutra idem u bioskop...,None,None,None,None,Positive,None,None
127,Pravi film za ove letnje dane!!!! Preporučujem ! :),None,None,None,None,Positive,None,None
128,"Film je toliko sranje, da bih mu dao 10, a ne 8, makar zbog 'rehabilitovanog' Haselhofa!",None,None,None,None,Negative,None,None
130,"Kao što piše gore u tekstu, ovaj film je parodija i namenjen je sarkastičnom ismevanju letnjih blokbastera. Svaki kao što kažeš ""očajni"" momenat direktno ismeva segmente koji se besramno guraju u visokobudžetnim filmovima. Poštujem tvoje mišljenje, ali pristup i očekivanja od ovog projekta su ti vrlo pogrešna.",None,None,None,None,None,Negative,None
132,"Stvarno odlična treš horor komedija! Po meni znatno bolja od Ajinog prvog dela. Uživao sam dok sam gledao, Izuzetno niske ocene na najbitnijim sajtovima koji se bave filmom su apsolutno neopravdane.",None,None,None,None,Positive,None,None
133,Bez veze!,None,None,None,None,Negative,None,None
136,"Od mene 10ka, jako uzbudljiv film. Dugo sam ga izbegavao zato što obično filmovi sa takvom glumačkom ekipom iznevere očekivanja, ali ovaj je bio daleko od toga. Di Caprio me najviše oduševio, ne znam što ga ljudi toliko hejtuju..",None,None,Positive,None,Positive,None,None
138,"ipak, filmčina. mada ne i kvalitetniji od Infernal Affairs, recimo podjednako kvalitetan, i mnogo lakši za praćenje s obzirom da nemaju svi iste face i nisu sva imena jen-sung-lu...",None,None,None,None,Positive,None,None
139,Slažem se! Dobar film!,None,None,None,None,Positive,Positive,None
140,"Ja baš primetih više WOW efektata, po meni oni uopšte ne nedostaju... ali to je samo moje mišljenje ;)",None,None,None,None,None,None,Positive
141,"Ako ćemo pošteno, ovo je verovatno najubedljiviji fantasy rad u poslednjih desetak godina, tj. otkad se ovaj podžanr poput zaraze proširio nakon The Lord of The Rings. Precizna režija, višeslojan scenario, ubedljiva veštica, fotografija, horor taman koliko treba...",Positive,Positive,None,None,Positive,None,None
142,"strašno loš film. ne znam šta mi bi da ga upalim kad sam ovde video četvorku... ne znam na osnovu čega se moja vršnjakinja kristin stjuard proslavila, ona blage veze sa glumom nema",None,None,Negative,None,Negative,None,None
143,patetika,None,None,None,None,Negative,None,None
144,"Odavno sam želela da pogledam ovaj film, a nakon pročitane recenzije konačno sam to i učinila. Šta reći sem fantastično! Veoma potresna priča, glavni glumac je definitivno opravdao nominaciju za oskara.",None,None,None,None,Positive,None,None
145,"Genijalno! Odlično! Skoro sam gledao The Road, i ovo je isto to. Možda je to smisao života, briga o drugom. Briga o bližnjem svom, ili na kraju, briga za ljude oko sebe. Jer, na početku i na kraju, ipak smo ljudi! Kako je govorio patrijarh Pavle: ""Budimo ljudi"".",None,None,None,None,Positive,None,None
147,Film bi bio mnogo mnogo zanimljiviji samo da su glumci malo kvalitetniji. Ja sam takođe imao velika očekivanja i pomalo ostao razočaran. Slažem se sa ocenom.,None,None,Negative,None,None,Positive,None
148,"Po meni film koji pogledam nakon posla, ako zaspim posle pola sata, NIJE dobar film. Svoj umor i pažnju merim dobrim filmom. Žao mi je.",None,None,None,None,Negative,None,None
149,"Baš slab film. Da nije Eve Grin msm da bi bio katastrofa. Može da se gleda jednom, a može i nikad. Bzvz za Bartona i Depa da rade ovako nešto.",None,None,None,None,Negative,None,None
154,molio bih recenziju filma muzika iz druge sobe sa džud louom u glavnoj ulozi film je po meni odličan,None,None,None,None,Positive,None,None
159,e s ovom se ocenom slažem... meni jedan od najdražih filmova :-),None,None,None,None,Positive,Positive,None
160,"Pogledao sam tek sad film, film je dobar, sviđa mi se ali mi fali nešto da mi ostavi potpuni utisak, jeste istinita priča i ne može se izmišljati ali fali mi nešto",None,None,None,None,Neutral,None,None
161,"Tek sada sam ga pogledao i film je, blago rečeno, odličan!",None,None,None,None,Positive,None,None
162,"Odličan film i recenzija kakvu ovakav film zaslužuje, što ti reče ''nije pretrpan skečevima i urnebesnim frazama''. Čitao sam neke na imdb i ova mi se najviše dopada. Francuzi ponovo razbili dobrim filmom. :)",None,None,None,None,Positive,Positive,None
163,Najjači od Francuza :D,None,None,None,None,Positive,None,None
165,Odličan film...,None,None,None,None,Positive,None,None
166,Ovaj film je pravo osveženje u poređenju sa svim skorašnjim holivudskim ostvarenjima. Iskreno više se ne može pogledati dobar film koji dolazi iz holivuda... A moram i da priznam da se u potpunosti slažem sa recenzijom.,None,None,None,None,Positive,Positive,None
167,"Iako obrađuje tešku temu, optimističan je. Dijalozi i humor su odlični, a izbor glumaca - pun pogodak, ""Drvo"" scena me je nasmejala do suza :) ! ps Veliko hvala Goranu i Bojanu, od kad sam otkrila ovaj sajt, filmski sati su mi daleko kvalitetniji i ugodniji!",Positive,None,Positive,None,Positive,None,None
169,Odličan film. Odavno se nisam ovako ismejala gledajući film. Pravo osveženje.,None,None,None,None,Positive,None,None
170,"Bravo! Svaka im čast! Uopšte nije kao što sam se bojao da će biti - američki! Totalno kontra! Manjifik, što bi rekli Francuzi! Pun pogodak za jednu ovakvu životnu priču!",None,None,None,None,Positive,None,None
171,"Priča je malo kliše, al na kraju film ima nešto svoje, drugačije.. sviđa mi se, kul je :)",Negative,None,None,None,Positive,None,None
172,Delim tvoje mišljenje u potpunosti... divan film...,None,None,None,None,Positive,Positive,None
173,"Veoma kvalitetno ostvarenje, baš me je iznenadio. Gledao sam ga već dva puta i opet ću pošto vidim da je stigao u bioskope. Pohvalio bih i odličan soundtrack koji je komponovao Ludovico Einaudi, kog slušam već proteklih mesec dana od kad sam pogledao film.",None,None,None,Positive,Positive,None,None
174,Odličan. Sinoć sam ga odgledao!,None,None,None,None,Positive,None,None
175,fantastičan,None,None,None,None,Positive,None,None
177,"Svi filmovi Wes Anderson-a su po meni čudni i neodoljivo šarmantni pa ni The Life Aquatic nije izuzetak. Bill Murray je ikona sam po sebi, a u Anderson-ovim filmovima uvek zablista u punom sjaju. Jedva čekam Moonrise Kingdom!",None,None,None,None,Positive,None,None
178,"veoma težak film jedan od najboljih koji sam gledao u ovom žanru, realan,",None,None,None,None,Positive,None,None
179,Odličan film,None,None,None,None,Positive,None,None
181,"Da, upravo tako, zavisi kako se tumači. Baš fin film, lagan, ponekad komičan, ali na kraju sa naravoučenijem. Odlično odrađen posao.",None,None,None,None,Positive,None,None
183,"Ovaj film ne zaslužuje ni delić mog vremena, ali sam ga nažalost greškom pogledao, a što se tiče Mel Gibsona, definitivno se oseća pad u njegovom radu, jer posle onakvih rediteljskih i glumačkih ostvarenja ovo je 1/10.",None,None,None,None,Negative,None,None
185,Kad si ga pre pogledao? Nedavno sam pogledao trejler i baš mi se dopao.,None,None,None,None,Positive,None,None
186,Posle Borata teško je ponoviti uspeh. Ništa više nego solidan film.,None,None,None,None,Neutral,None,None
188,"Ma dobar je Saša. Sviđa mi se što nije napravio još jedan film u dokumentarnom stilu. Jedino mi je truba, što su sve dobre fore stavili u trejlere. Moja greška što sam ih gledao.",None,None,None,None,Positive,None,None
189,"Slažem se sa dovla. Saša Baron Koen pravi filmove bez ikakve vrednosti, čija je svrha samo da sablažnjavaju. Klozetski humor, nedostatak dobrog scenarija i gomila prizemnih gluposti. Sa 90% posto kritika na ovom sajtu se slažem, ali sad ste omanuli.",Negative,None,None,None,Negative,Positive,None
190,pre će biti 2/10 ocena ali ajde. ima dobrih fora ali definitivno ima gomilu gluposti i budalaština za nivo predškolskog uzrasta (ako izuzmemo neke neprimerene scene).,None,None,None,None,Negative,None,None
191,"Kao što sam i mislio, film godine u najavi...",None,None,None,None,Positive,None,None
192,Lepa recenzija :-) ovo je baš drag film i skroz odgovara i ženama i muškarcima :-),None,None,None,None,Positive,Positive,None
193,"FILM JE APSOLUTNO PUN POGODAK!!! DAVNO SAM GA GLEDAO, ALI KAD SE I SAD SEĆAM MNOGIH SCENA, ONDA ZNAČI DA VREDI SVAKOG MINUTA. i UOPŠTE NIJE MUŠKI ŠOVINISTIČKI FILM. POGLEDAJTE OBAVEZNO NEOPTEREĆENI PREDRASUDAMA, UŽIVAĆETE.",None,None,None,None,Positive,None,None
195,"Ovo je onda očigledno muški film. :) Ne poznajem nijednu ženu koja bi se ovom filmu vraćala. Podnošljiv film za nedelju uveče, ništa više od toga.",None,None,None,None,Neutral,None,None
197,Odličan film sa odličnim Vigom Mortensenom.,None,None,None,None,Positive,None,None
198,"Koja apokalipsa, majko mila! Koje sivilo, crnjak i depresija! Svaka čast za scenografiju, genijalno odrađena! Jedina luča svetlosti - roditeljska ljubav ka sinu! I još ono malo međuljudskih odnosa kojih je bilo! Odličan film.",None,None,None,None,Positive,None,None
199,Hvala na recenziji.,None,None,None,None,None,Positive,None
201,Jedan od najboljih iz 2009. Trebalo bi knjigu pročitati.,None,None,None,None,Positive,None,None
202,"Mnogo dobar film! Kao što reče recenzija, ""intelektualni triler""! Tačno tako, odlično odrađen posao!",None,None,None,None,Positive,Positive,None
203,"Savršena recenzija, savršen film.",None,None,None,None,Positive,Positive,None
205,"Odličan film! Pun pogodak, što se tiče svega navedenog! Maestralno!",None,None,None,None,Positive,None,None
206,Film je odličan.. mada kraj mi nešto nije baš najjasniji... :D,None,None,None,None,Neutral,None,None
207,najbolji film u zadnjih par godina,None,None,None,None,Positive,None,None
208,"jedan od lošijih i dosadnijih filmova i inače izvikane braće koen; film je odmah sjajan ako se bavi nasiljem u američkom kolektivno nesvesnom, ma nije valjda; bardem je jedina prava vrednost ovog filma",None,None,None,None,Negative,None,None
209,jedan od najboljih filmova u zadnjih deset godina!,None,None,None,None,Positive,None,None
210,"Ovako: Mislim da je ova ocena previsoka. Film jeste dobar, čak i dosta dobar. Zaslužuje 8.5/10.",None,None,None,None,Positive,Negative,None
212,Fenomenalan film! Meni nije jasno... šta nije jasno :),None,None,None,None,Positive,None,None
214,"Odličan film. Treba napomenuti i sjajnu rolu Tommy Lee Jonesa u ulozi lokalnog šerifa. Naravno, film prvo pamtim po frizuri http://d3j5vwomefv46c.cloudfront.net/photos/full/...",None,None,Positive,None,Positive,None,None
215,Ja ga isto naprosto obožavam. Instant klasik.,None,None,None,None,Positive,None,None
216,Preterano dobar. Mislim da posle ovog nisu uspeli da se nadmaše. Dobro si me podsetio. Valjalo bi ovo pogledati ponovo.,None,None,None,None,Positive,None,None
217,"Nego šta, sami vrh! Antologijski film braće Koen! Maestralno!",None,None,None,None,Positive,None,None
219,"Pa dobro, nisi ga baš razjasnio, al ajde... :) Ja ga zaista nisam razumeo, ali ću ga opet pogledati u nadi da ću uvideti sve te metafore, tajming, itd... :).... ali baš 10/10???... ne bih rekao, no dobro... :)",None,None,None,None,None,Negative,None
220,molio bih recenziju filma kutija sa Umom Turman u glavnoj ulozi meni je film odličan,None,None,None,None,Positive,None,None
222,Kraj je smorio! Skroz nedorečen...,None,None,None,None,Negative,None,None
224,"+1	492-1	Evo malopre ga pogledah na tvoju preporuku i baš mi se dopao, dosta je zanimljiv i poučan. Pogledaću i ostale filmove od Alexander Payne da se uverim da li je genije"" kako si ga nazvao.",None,None,None,None,Positive,None,None
225,+1	491-1	Odličan film!,None,None,None,None,Positive,None,None
226,"-1	490-2	Ovaj Gačić ima jako loš ukus, mislim da ne bi trebao da piše recenzije! Pratim ga već neko vreme...",None,None,None,None,None,Negative,None
228,"+M	489-11	Po meni film je dosta dobar iako nisam očekivao, jeste radnja prosta i nema nikakvih obrta i slično, akcione scene su izvukle ceo prosek jer su stvarno jako uzbudljive, najbolji marvelov film u poslednje vreme ocena 8/10 :)",None,None,None,None,Positive,None,None
229,"+1	489-10	dobar film, ocena čista 8 jer smatram da je mogao biti još bolji.",None,None,None,None,Neutral,None,None
232,"+M	489-6	film se svideo i meni i mojim drugarima 7/10. iako volim filmove sa zapletom, ovaj film mi je držao pažnju sve vreme, ali sam na kraju imala utisak da predugo traje.",None,None,None,None,Neutral,None,None
233,"+1	489-5	Film je odličan, za ovakve filmove po mom mišljenju nije potreban neki žestok zaplet.",None,None,None,None,Positive,None,None
235,"+M	489-4	Imam utisak da ste prestrogi. Film je po meni (moje lično mišljenje) izuzetno uspešan, vaše primedbe stoje ali ne smetaju toliko i ne unakazuju film. Naravno svako ima svoj ukus....",None,None,None,None,Positive,Negative,None
236,-1	489-2-1	Milena da si odgledala film drugačije bi mislila :),None,None,None,None,None,Negative,None
237,"-1	489-2	Potpuno se slažem, nikakav zaplet, dijalozi retardirani, Battleship sa Rihanom mi bio mnogo zanimljiviji! :)",Negative,None,None,None,Negative,None,None
239,+M	487-1	Slažem se sa ocenom...,None,None,None,None,None,Positive,None
240,+1	486-9	Odličan film koji mogu više puta gledati (Insomnia). Sigurno jedan od pet mojih omiljenih trilera.,None,None,None,None,Positive,None,None
241,+1	486-8	jako težak ali sjajan film sa odličnom glumačkom ekipom,None,None,Positive,None,Positive,None,None
242,"-M	486-7	Kakva osmica, ovaj film je za 10! Opet loša ocena, morate da se bolje potrudite oko ocenjivanja! Kad je kritika u pitanju morate biti i pristrasni i objektivni u isto vreme!",None,None,None,None,Positive,Negative,None
243,"+1	486-6	Nema više ovakvih filmova... Stari predobri, odgledan dvadesetak puta. Čista 10-ka.",None,None,None,None,Positive,None,None
