,text,Radnja,Rezija,Gluma,Muzika,Opsti utisak film,Opsti utisak komentar,Specijalni efekti
53,Ko je upravo spavao sa najboljom drugaricom neka odgleda film.... pevušiće zajedno i verovaće u večnu ljubav... sve dok ih neki konj ne prekine!!!!,None,None,None,None,Neutral,None,None
54,dobro,None,None,None,None,Positive,None,None
55,molim gospodina koji je ocenjivao film da razmisli o menjanju posla jer se neće baš nešto HLEBA najesti.,None,None,None,None,Negative,Negative,None
56,Prvi film vredan pomena u 2011. godini? Pa ti u stvari nemaš pojma o filmovima.,None,None,None,None,Negative,Negative,None
58,uvreda za mozak na kvadrat. Ovo je jedan od filmova koje samo najuporniji mogu da odgledaju do kraja,None,None,None,None,Negative,None,None
59,smeće prepuno preuveličanog američkog patriotizma i klišea,None,None,None,None,Negative,None,None
60,Ovaj film je uvreda za mozak,None,None,None,None,Negative,None,None
61,"Scenografija i kostimografija su najbolji deo filma :) eh da da ne zaboravim i saundtrek, bio je odličan! Gluma jeste traljava, ali film ajd nije baš toliko loš!",None,None,Positive,Positive,Neutral,None,Positive
62,extra :-),None,None,None,None,Positive,None,None
63,"Ma simpatično skroz. Amanda je neverovatno sexy u crvenom ogrtaču s kapuljačicom, gde njena duga plava kosa dolazi do izražaja. Oldman na nivou, a ostali su mogli i bolje da odglume svoje role. Dobra atmosfera, a upotreba CGI efekata nije nešto preterana, što je meni sasvim OK.",None,None,Positive,None,Neutral,None,Neutral
64,"Iskreno, meni se film dopao. Klasična, opuštajuća pričica za sve uzraste...",None,None,None,None,Positive,None,None
66,"Odgledao sam čisto da ispoštujem ekipu.... Kada me neko pita o čemu se ""radi"" u filmu jednostavno odgovorim ""Da me j...š ne znam al nije loš, lep snimak imam""",None,None,None,None,Neutral,None,None
67,NULA,None,None,None,None,Negative,None,None
68,4. deo je čist promašaj.,None,None,None,None,Negative,None,None
71,"nije katastrofa, ali i ništa spektakularno. ništa što očekuješ od onakvog uvoda se na kraju ne ispuni. glumci su super ali je priča bzvz, pogotovo kad se pojave dva dinosaurusa. da li je možda u trenutku kada veći udara manjeg hteo da pojasni suštinu nesretne današnjice? ili ne? :-)",Negative,None,Positive,None,Neutral,None,None
72,veću glupost nisam video..... katastrofa.,None,None,None,None,Negative,None,None
73,"Prijatelju, moj savet u zivotu ti je da ćutiš ako nemaš šta da kažeš. A ti baš nemaš šta da kažeš. I dopusti drugima da uživaju u filmu ako tako osećaju.",None,None,None,None,None,Negative,None
74,film je užas... Tokom svog života sam toliko ojačao želudac sa svakakvim lošim filmovima da sam poprilično oguglao na budalaštine. Pored svega toga je ovaj film uspeo da mi ogadi SF filmove!!! naziv vam govori sve....,None,None,None,None,Negative,None,None
75,film je totalna budalaština,None,None,None,None,Negative,None,None
76,nije uopšte loš za nedeljno popodne,None,None,None,None,Positive,None,None
78,"Film kao film predstavlja sliku sveta nakon virusne apokalipse, ali činjenice o samoj zarazi i prenošenju iste su jako neubedljive i imaju dosta propusta... ali, osim ljudi sa dosta medicinske ekspertize, ostalim će film biti vrlo gledljiv :)",None,None,None,None,Neutral,None,None
81,"Film katastrofa. Obavezno preskočiti... Ono što najviše boli producente je činjenica da je film navodno koštao 250 miliona dolara!?, a na box officeu je uspeo vratiti svega pola od te sume...",None,None,None,None,Negative,None,None
82,Interesantan film,None,None,None,None,Positive,None,None
84,Baš ono što se očekuje od Almodovara! Odličan. :)),None,Positive,None,None,Positive,None,None
85,"Bolesno... Ali, vrlo dobro! Savetujem pogledati.",None,None,None,None,Positive,None,None
87,"Nije loš, mada ništa spektakularno... na ivici između realnosti i fikcije, kao i skoro uvek kod Almodovara, bolesno, kao uvek kod Almodovara.",None,Neutral,None,None,Neutral,None,None
88,"Serija jedva da prati dešavanja iz stripa, dakle samo neke osnovne stvari. Međuljudski odnosi i dijalozi daleko su interesantniji u originalu. Ne znam da li je to zbog prevelikih očekivanja, ali druga sezona se bukvalno igrala sa granicama našeg strpljenja.",None,None,None,None,Neutral,None,None
89,"meni je ovo presporo i nekako pomalo prevaziđeno, ima puno boljih serija danas a treba to sve pogledati",None,None,None,None,Negative,None,None
91,"Slažem se ,,,film je rapsodija dosade i lažnih emocija,,, preporuka ,,,,izbeći po svaku cenu!!",None,None,None,None,Negative,None,None
93,film je extra,None,None,None,None,Positive,None,None
94,loše... katastrofa od filma. 3D nepotreban...,None,None,None,None,Negative,None,None
95,Fantastičan film. Pogotovo u 3D-u. 8),None,None,None,None,Positive,None,None
96,Loše odrađeno nažalost...,None,None,None,None,Negative,None,None
97,"ok, tekst jeste malo hipsterski ali svejedno me je ubedio da počnem ""nabavljati"" ovo :)) veliki sam fan spomenute breaking bad pa taman dok čekam ovo, overim justified",None,None,None,None,Positive,Positive,None
98,super je,None,None,None,None,Positive,None,None
99,"Smeće od ""filma"".",None,None,None,None,Negative,None,None
100,super je :) najbolja je baba!!,None,None,None,None,Positive,None,None
101,bio sam ekstra je ovo je najbolje ledeno doba,None,None,None,None,Positive,None,None
102,"Ovo ću preskočiti... Ovo leto je Holivud smorio sa crtaćima. Madagascar, Brave, a sad i Ice Age 4.",None,None,None,None,Negative,None,None
103,Dobarrr,None,None,None,None,Positive,None,None
104,"Odličan, Gledao u 3D, preporučujem svima!!!!!!!!!!!!!!!",None,None,None,None,Positive,None,None
105,Ocena za film je 5/5 bez pogovora!!!,None,None,None,None,Positive,None,None
106,"Film je odličan! Triler-akcija na nivou prethodna tri dela, samo ovaj put jasno bez Met Dejmona. Saga valjda ide dalje...",None,None,Neutral,None,Positive,None,None
107,Najbolji je! :))),None,None,None,None,Positive,None,None
109,"Loš. Prva dva dela su i korektna, ali sve dalje za zaborav...",None,None,None,None,Negative,None,None
110,"Najbolja-Najjača konverzacija filma: Jugde Dredd: Inhabitants of Peach Trees, this is Judge Dredd. Ma-Ma: Let him talk. Jugde Dredd: In case you have forgotten, this block operates under the same rules as the rest of the city. Ma-Ma is not the law... I am the law.",None,None,None,None,Positive,None,None
111,Odlična SF akcija! Sve preporuke.,None,None,None,None,Positive,None,None
112,Ko nije gledao pravac bioskop!!! Ja sam ušao skeptičan u salu a izašao oduševljen!!!,None,None,None,None,Positive,None,None
113,FENOMENALNA,None,None,None,None,Positive,None,None
114,ovu seriju morate pogledati obavezno najjača serija ikada snimljena,None,None,None,None,Positive,None,None
115,Fenomenalna serija,None,None,None,None,Positive,None,None
116,5 sezona... Pratim je već neko vreme. Odlična.,None,None,None,None,Positive,None,None
117,odlična,None,None,None,None,Positive,None,None
118,"Suvi kvalitet, po meni jedna od najboljih serija ikad!",None,None,None,None,Positive,None,None
119,"Vrh serija, preporuka svima",None,None,None,None,Positive,None,None
120,Serija je za 10... pa ko ne veruje neka proveri...,None,None,None,None,Positive,None,None
121,fenomenalna... ja sam se srodila sa junacima serije.. Omar je car,None,None,None,None,Positive,None,None
122,"odlična serija, jedna od najboljih ikada snimljenih.",None,None,None,None,Positive,None,None
124,Ovaj film je najbolji na svetu :-) imam već 18 godina i mislim da nema boljeg filma ;-),None,None,None,None,Positive,None,None
126,"Dobar film, dobri dijalozi, još bolja gluma.",None,None,Positive,None,Positive,None,None
127,"@Shibby, iako si bio saglasan sa mnom oko Teda moram da kažem da ja ipak sada uopšte nisam saglasan sa tobom po pitanju ovog... Film je fantazija!! 10/10 (a ne volim Tarantinove filmove generalno)",None,None,None,None,Positive,Negative,None
128,9/10 bez sumnje.,None,None,None,None,Positive,None,None
129,"Nisam ljubitelj ni stripa ni filma.. ali mogu samo da kažem da mi se Brendon činio savršenim za ulogu a ne ovaj.. ali tako je na prvi pogled, možda grešim!",None,None,Neutral,None,Negative,None,None
134,"Vulgarno ali i dalje smešno. Uvek kažem neću da gledam to sr..nje ali nikad ne izdržim "")",None,None,None,None,Positive,None,None
135,"Dobar film, dobro uklopljen sa prethodnim delovima, priča ima smisla, nema preterivanja. Ispunjena očekivanja",Positive,None,None,None,Positive,None,None
136,"Najobičnija papazjanija događaja, likova i ideja.. Samo Hollywood i njegova žeđ za novcem može nastaviti ovakvu nekrofiliju nad franšizom koju smo nekad voleli (računam T1 i T2)!!!",None,None,None,None,Negative,None,None
137,"Amaterski scenario, dobri vizuelni efekti i to je sve. Potencijal za dobar film, ali neiskorišćen.",Negative,None,None,None,Neutral,None,Positive
138,"Nije loš film, vredi pogledati.",None,None,None,None,Positive,None,None
139,Sinoć gledao. Nije loše ali nekako mi ravno. Nema onu čar starih Mad Max filmova. Nešto mi tu fali. Ipak solidna sedmica.,None,None,None,None,Neutral,None,None
140,veću glupost skoro nisam gledao,None,None,None,None,Negative,None,None
141,Razočaranje totalno. Još kad pomislim da sam hteo da vodim curu na to. Ostavila bi me istog momenta ;),None,None,None,None,Negative,None,None
142,"Odličan film, svaka preporuka...",None,None,None,None,Positive,None,None
143,Odličan...,None,None,None,None,Positive,None,None
144,Odličan film.,None,None,None,None,Positive,None,None
147,Nije dobar kao prvi deo ali svejedno je dovoljno dobar.,None,None,None,None,Positive,None,None
148,Žestoko i brzo kao što se i očekivalo. Definitivno akcioni film godine i lep oproštaj od Pola.,None,None,None,None,Positive,None,None
149,Nije bilo nijednog dosadnog momenta a scena na kraju je zaista lepo osmišljena. Poslednjih 10 minuta je bilo srceparajuće. Zamalo suzu da pustim...,None,None,None,None,Positive,None,None
150,Ludilo i prženje na sve strane. Za 10 dana prešao 800 miliona dolara. Sigurno će preći milijardu.,None,None,None,None,Positive,None,None
151,Sinoć gledala. Baš sam se razočarala. Nekako sve bledunjavo i glumci totalno neharizmatični. Montevideo je bio mnogo bolji.,None,None,Negative,None,Negative,None,None
152,Koje s..nje od filma. Dosadno i nezanimljivo a riba nije nimalo sexy,None,None,None,None,Negative,None,None
153,"Ne bih se složio, glumica je vrlo seksi. Film je promašaj, previše mazohizma i sadizma, ali nije loše pogledati.",None,None,Neutral,None,Negative,None,None
154,Očekivao sam malo više priče o dešifrovanju a malo manje njegove lične drame i problema homoseksualaca iz tog vremena.,Negative,None,None,None,None,None,None
155,Odličan film. Benedikt je sjajan a i ostali su jako dobri.,None,None,Positive,None,Positive,None,None
156,Jedan od najboljih filmova ove godine,None,None,None,None,Positive,None,None
157,"Odličan film. Obavezno gledajte. Čovek koji je spasao svet od produžetka WWII, i kako je stradao. Pobedom nad nemačkom Enigmom dobijen je brže i efikasnije WWII.",None,None,None,None,Positive,None,None
158,Preporuka. Odličan film.,None,None,None,None,Positive,None,None
159,"Početak obećavajući, nakon toga dosada za desetku!",None,None,None,None,Negative,None,None
160,Ovde svaki sledeći sve gori. Zašto kvariti utisak koji je napravio prvi film.,None,None,None,None,Negative,None,None
161,dooobar,None,None,None,None,Positive,None,None
164,"Kristijan Bejl je dobar kao i uvek, ima čovek harizmu ali ovaj Ramzes je katastrofa. Deluje kao neki trandža a ne jedan od najvećih faraona u istoriji.",None,None,Positive,None,None,None,None
166,Juče pogledao film. Dok je drugi smorio s dužinom ovde su stvarno mogli malo duže. Ovako deluje nedovršeno.,None,None,None,None,Neutral,None,None
169,Pogledao juče i prilično mi je bolji od 2. dela.,None,None,None,None,Positive,None,None
170,Da i meni se svideo. Ima više duha i emocija nego drugi deo koji mi je baš bio dosadan.,None,None,None,None,Positive,None,None
172,Malo drugačiji zaplet. Sasvim solidan triler ali ne treba očekivati ništa spektakularno.,None,None,None,None,Positive,None,None
173,Ovaj lik posle taken prvi deo nikako da snimi dobar film. Razvučeno i dosadno ...,None,None,None,None,Negative,None,None
174,Ništa posebno. Volim Liama ali imao je i boljih filmova.,None,None,Positive,None,Negative,None,None
176,Jako dobar. Ovo vredi još jednom pogledati.,None,None,None,None,Positive,None,None
177,Ovo se svidelo čak i mojoj ženi a ona baš ne voli fantastiku. Jedva sam je dovukao u bioskop :),None,None,None,None,Positive,None,None
178,Film je dugačak ali uopšte se ne primeti. Ni na trenutak nije dosadno. Vizuelni efekti i soundtrack su fantastični. Jaka 8 po mom mišljenju .,None,None,None,Positive,Positive,None,Positive
179,Moram priznati da sam više očekivao. Početak malo razvučen ali ok. Posle je bilo zanimljivo sve do momenta kad se prešlo malo na fantaziju. Tu mi je film malo pao. Po meni 7,None,None,None,None,Neutral,None,None
180,Posle ovog filma čovek baš shvati kako vreme brzo prolazi,None,None,None,None,Positive,None,None
181,"Ovo je jedan od najboljih filmova koje sam ja gledala, najtoplije preporučujem svima",None,None,None,None,Positive,None,None
183,"Film onako, ništa posebno, mlak početak, nekoliko nelogičnosti, sve kao da mu fali nešto. Loša kopija Odiseje u svemiru, moje mišljenje. Ocena 6.",None,None,None,None,Neutral,None,None
184,Još jedan dobar film. Ne volim ratne ali ovaj mi je stvarno bio dobar.,None,None,None,None,Positive,None,None
185,Iznenadio me ovaj film. Krenulo je prilično mlako i već sam se pitao zašto ima toliko dobru ocenu ali onda sam u drugoj polovini filma shvatio zašto je to tako :).,None,None,None,None,Positive,None,None
186,Film koji vredi pogledati!,None,None,None,None,Positive,None,None
187,Denzel rastura. Jedva čekam da vidim Kijanu šta je uradio sa John Wickom,None,None,Positive,None,None,None,None
188,"Početak odličan, malo kvari utisak druga polovina filma ali sve u svemu jedan od boljih ove godine.",None,None,None,None,Positive,None,None
189,"Denzele, Denzele... Šta ti bi da snimiš ovo? Još i preporuke... kukuuuu",None,None,Neutral,None,Negative,None,None
190,KATASTROFA!!!,None,None,None,None,Negative,None,None
191,Mnogo nelogičnosti ali ipak gledljiv film. Ako se isključi mozak čak zanimljiv ...,None,None,None,None,Neutral,None,None
193,Dokle više. Zešće su smorili.,None,None,None,None,Negative,None,None
195,Film je totalno ludilo. Davno se nisam tako zabavio.,None,None,None,None,Positive,None,None
196,Nije mi baš jasno što se masa toliko loži na ovo. Osrednji film,None,None,None,None,Neutral,None,None
197,"Odličan film. 5+ Ispravka: radnja filma nije u 31 veku već danas, samo mnogo daleko.",None,None,None,None,Positive,None,None
198,Rok na steroidima ali baš loš film. Malo bolji od prethodnog herkula ove godine,None,None,None,None,Negative,None,None
199,Užas. Kome je ovo smešno nije mi jasno,None,None,None,None,Negative,None,None
200,Koje sr.nje od filma,None,None,None,None,Negative,None,None
201,Konačno jedan dobar Sandlerov film,None,None,Positive,None,Positive,None,None
202,Odličan. Majmuni u filmu bolje glume od ljudi.,None,None,Positive,None,Positive,None,None
203,Jedan od retkih filmova u poslednje vreme koji sam odgledao sa pažnjom. Dobar film za sve koji vole onu pravu naučnu fantastiku.,None,None,None,None,Positive,None,None
204,Interesantan film. Malo drugačiji pogled na poznatu bajku. Anđelini je lik potpuno legao.,None,None,Positive,None,Positive,None,None
205,Ajoj gluposti. Ima li neka dobra komedija u poslednje vreme,None,None,None,None,Negative,None,None
206,Dosada. Lik ceo film priča telefonom.,None,None,None,None,Negative,None,None
207,Simpatična komedijica. Kameron matora ali zgodna. Stvarno ne vidim zašto se muškarci lože na tu Kejt Apton.,None,None,Neutral,None,Positive,None,None
208,Neobičan ali dobar film,None,None,None,None,Positive,None,None
209,Jel neko gledao ovo. Čuo da ga hvale ali meni je negledljiv,None,None,None,None,Negative,None,None
210,Jedino što je stvarno ubijeno u filmu jeste 117 minuta,None,None,None,None,Negative,None,None
211,Prva polovina filma deluje kao tipično američko proseravanje ali posle kad se zakuva film postaje dobar.,None,None,None,None,Positive,None,None
212,"Za ljubitelje dobrog akcionog filma, prava poslastica.",None,None,None,None,Positive,None,None
213,Vrlo interesantan film. Vizuelno prelepo urađen. Određeni momenti podsećaju na odiseju 2001. Vredi pogledati,None,None,None,None,Positive,None,Positive
214,Rusel odličan kao i uvek a Ema Votson bolje da se drži Hari Potera. Stvarno nema neki glumački raspon.,None,None,Neutral,None,None,None,None
216,300 na vodi. Mnogo nasilja i akcije i dobre sex scene ali ništa novo,None,None,None,None,Neutral,None,None
217,Volim ovaj tip filmova ali baš me nervira ovo beskrupulozno iskorišćavanje franšize. Zašto se ovo uopšte zove 300. Za njih 300 nisu završili u prvom delu.,None,None,None,None,Positive,None,None
218,Jedino što glume ova dvojica ali film realno nije ništa posebno.,None,None,Positive,None,Neutral,None,None
219,Odličan je. Mada malo lepši mi je bio prvi deo.,None,None,None,None,Positive,None,None
220,Super. Volim kad naši prave ovakve filmove. Da nije na srpskom ladno može proći kao strani. Lepa promena.,None,None,None,None,Positive,None,None
221,"Dobar film, samo baš dugo traje. Treba izdržati 3 sata",None,None,None,None,Positive,None,None
222,Leonardo odličan. Glavni kandidat za oskara. Jeste dugačak film ali vredi pogledati. Kako neki ljudi lako dođu do velikog novca pa to je neverovatno,None,None,Positive,None,Positive,None,None
224,Loodilo od filma. Čujem da ima i verzija od 4 sata,None,None,None,None,Positive,None,None
225,"film je odličan. ali glavni lik uopšte nije ""lako zaradio lovu"", kako misle raniji komentatori... Tip ima genijalnost i žvaku za prodaju deonica, ali i kršili su zakon kako je to bilo moguće u to vreme... sve u svemu, priča istinita i inspirativna za film!",None,None,None,None,Positive,None,None
226,Gledao juče. Ovaj 3D mi se uopšte ne sviđa. Sve mi nešto suviše mračno i pomalo mutno. Ne znam da li zbog lošeg kvaliteta naočara ili je to baš tako snimano ali baš pokvari utisak.,None,None,None,None,Negative,None,None
227,Uh baš mnogo sam očekivao od ovoga ali prvi deo mi je ipak bio bolji. Mnogo akcije i to bespotrebno razvučene.,None,None,None,None,Negative,None,None
228,"Koja navala. Nikad nisam video ovakvu gužvu u bioskopu. Film je odličan, preporučujem.",None,None,None,None,Positive,None,None
229,Uh nešto su mi sporo prošla ova 3 sata. Ono sa Šmaugom je baš razvučeno. Sad se pitam da li ću gledati treći deo u bioskopu.,None,None,None,None,Negative,None,None
230,Šta pričate ljudi meni je film bio odličan. Akcije taman koliko treba. Nadam se i treći deo da će biti u istom stilu.,None,None,None,None,Positive,None,None
231,"Koji smor od filma. Samo sam čekao kraj. Priča bezveza, likovi bezveze. Ovo mi liči na ono kako modni kreatori zamišljaju sci fi. Užas.",Negative,None,None,None,Negative,None,None
232,Prvih pola sata i nije tako tipično američki predvidljivo dosadno,None,None,None,None,Neutral,None,None
233,Meni je prvi bio bolji. Nemam pojma čemu toliko pirotehnike kao da je rat zvezda u pitanju. Očekivao sam više skandinavske mitologije a manje fantastike,None,None,None,None,Neutral,None,None
234,Definitivno je prvi bolji. Kenet Brana je napravio ozbiljniji film a ovo je za decu. Kao naučna fantastika za decu.,None,None,None,None,Negative,None,None
235,Film je žešće smaranje. Više kao crtani film. Par puta se nasmejete na silu i to je to. Emotivno vas uopšte ne angažuje. Kao i pirati s kariba. Verbinskom bolje idu animirani filmovi.,None,Negative,None,None,Negative,None,None
236,Odličan film. Ne volim filmove o formuli jedan i trkama ali ovde mi to uopšte nije bilo problem. Preporuka :),None,None,None,None,Positive,None,None
237,Mnogo dobar film.,None,None,None,None,Positive,None,None
238,Mislila sam da Hemsvort samo dobro izgleda ali sad vidim da zna i da glumi :),None,None,Positive,None,None,None,None
239,"Sve preporuke za film. Jako dobra priča bazirana na stvarnim događajima, prikazuje takmičarski duh, rizik sporta koji kod nas uopšte nije popularan a jedan je od najrizičnijih, naročito u to vreme. Emocije, radnja, duh, napetost…. sve u jednom. Sve preporuke !",Positive,None,None,None,Positive,None,None
240,Stvarno ne znam otkud ovolika frka oko ovog filma. Scenografija u svemiru lepa ali po meni ceo film je ravna linija,None,None,None,None,Negative,None,Positive
241,Početak je možda malo lošiji ali posle postane dobro. Ipak prvi deo mi je bio malo bolji.,None,None,None,None,Neutral,None,None
242,"Vredi pogledati, dobra drama. Šta je sve čovek spreman da uradi da bi pronašao dete",None,None,None,None,Positive,None,None
243,Odličan ali malo težak film. Nije baš za popodnevni ručak ali za subotu uveče taman.,None,None,None,None,Positive,None,None
244,Odličan ! ! !,None,None,None,None,Positive,None,None
245,"Ne volim kada je žrtva u filmu dete ili porodica, jako me to uznemiruje.",None,None,None,None,Neutral,None,None
246,"Legao sam umoran i pospan, film sam pustio iz navike i odgledao do kraja. Film drži pažnju... Da ne preteram dobra osmica.",None,None,None,None,Positive,None,None
247,Odličan film. Preporučujem svima .,None,None,None,None,Positive,None,None
248,Nije mi jasno što se ljudi lože na ovaj tip filmova. Svi su na isti fazon,None,None,None,None,Negative,None,None
249,Nije ni tako loš kao što pričaju. Zanimljivo videti jednu takvu životnu priču ako ništa drugo,None,None,None,None,Positive,None,None
250,Ne znam. Meni Ešton Kučer nije uopšte ubedljiv kao Džobs. Mislim da su mogli naći mnogo boljeg glavnog glumca.,None,None,Neutral,None,None,None,None
251,Ovaj film deluje kao neki trip glavnih likova. Nije mi se baš svideo.,None,None,None,None,Negative,None,None
252,Kakva bljuvotina od filma. Baš nijednom da nasmeje za sat vremena. Bačena 2 sata života...,None,None,None,None,Negative,None,None
253,Ne mogu da kažem da je film dosadan ali prvi je definitivno bio bolji,None,None,None,None,Neutral,None,None
254,Najbolje ekranizovana manga do sada. Vidi se da je evropljanin (Del Toro) iza toga. Sve je kako treba i definitivno je bolje od transformersa koji su prava američka bljuvotina.,None,Positive,None,None,Positive,None,None
255,Simpatična komedijica. Sandri više leže ove komedijice nego ozbiljni filmovi.,None,None,Positive,None,Positive,None,None
256,"Mnogo dobar muvi, dragica i ja oduševljeni",None,None,None,None,Positive,None,None
257,Jedna od retkih komedija u poslednje vreme da je uspela da me nasmeje.,None,None,None,None,Positive,None,None
258,Sinoć gledala u bioskopu. Odličan je :),None,None,None,None,Positive,None,None
259,Dženifer odlično izgleda nema šta ;),None,None,Neutral,None,None,None,None
260,Dobar. Sasvim drugačiji od tipičnih holivudskih filmova. Pravi hardcore sci-fi,None,None,None,None,Positive,None,None
261,Koga interesuje priča o volverinu a manje o ostalim mutantima preporučujem gledanje,None,None,None,None,Positive,None,None
262,Priznajem više sam očekivao od ovog. Dobro Džekmenu leži ta uloga ali nikako da potrefe pravu stvar :(,None,None,Positive,None,Negative,None,None
263,"Kakve gluposti oni nama uvaljuju. Već viđeno, samo malo drugačije upakovano",None,None,None,None,Negative,None,None
264,Užas. Počeo da gledam pa nisam izdržao. Koji man in black rip.,None,None,None,None,Negative,None,None
265,Koje s....e. Ovo je još gore od olimpusa. Zašto uvek moraju da snime i da puste 2 ista filma u istom periodu.,None,None,None,None,Negative,None,None
266,Zanimljivo videti malo google iznutra ali nije baš smešno. Još jedna neuspela komedija ali definitivno je lepo raditi u google-u.,None,None,None,None,Negative,None,None
267,Užas. Apsolutno nikakve originalnosti. Kao da se ništa nije promenilo u horor žanru za 20 godina. Deluje smešno a ne strašno,None,None,None,None,Negative,None,None
268,"Jurnjava, puno akcije i uopšte ni u jednom trenutku nije dosadno a scena u kojoj se Rok i Dizel bore protiv ogromnog negativca je scena zbog koje pravi ljubitelji akcije moraju pogledati film :)",None,None,Neutral,None,Positive,None,None
269,Film je ludilo. Dobro možda su malo preterali sa akcijama ali je svejedno zabavan,None,None,None,None,Positive,None,None
270,Baš me nije nešto oduševio. Ovo je više jedan dugački spot nego film. Nekako sve se odvija previše brzo i teško se vezati za likove.,None,None,None,None,Negative,None,None
271,Ništa posebno. Sve je šareno i vizuelno lepo ali to je sve. Baš razočarenje.,None,None,None,None,Negative,None,Positive
272,Leonardo je odličan. Stvarno mu stoji ta uloga ali film nije opravdao očekivanja.,None,None,Positive,None,Negative,None,None
273,Možda malo više akcije nego što je uobičajeno za zvezdane staze ali sasvim dobar film. Na nivou prethodnog dela.,None,None,None,None,Positive,None,None
274,Ovaj lik što glumi Kana totalno nosi film. Stvarno odličan glumac. Mislio sam da ću ga doživeti kao Šerloka ali skroz je ubedljiv i kao Kan.,None,None,Positive,None,Neutral,None,None
275,Lepo vizuelno odrađeno. Povratak korenima naučne fantastike. Bez nepotrebnih eksplozija i akcija sa naglaskom na priču,None,None,None,None,Positive,None,Positive
276,"Pa i nije tako loše kao što svi pričaju. Uzbudljivo i zabavno, jedino možda više odstupa od knjige.",None,None,None,None,Positive,None,None
277,Pa ovaj film veze nema sa hangover-om. Vidi se da su hteli da uzmu lovu na staru slavu. Najgori deo ubedljivo,None,None,None,None,Negative,None,None
