,text,Radnja,Rezija,Gluma,Muzika,Opsti utisak film,Opsti utisak komentar,Specijalni efekti
930,"film je fantastičan, jedan od najboljih ruskih koje sam imao prilike da gledam.. svaka preporuka... posebno su zanimljive fotografije na kraju filma koje idu u slajdu...",None,None,None,None,Positive,None,None
931,"odličan film, dečaci glume fantastično, veliko otkrovenje, čista 10",None,None,Positive,None,Positive,None,None
932,"@Ufi: probaj na http://titlovi.com/ ja sam tu našao! A što se tiče Rusa, kao po običaju, teška psihologija! Teška drama, pa još sa svim tim psihološkim aspektima! Au kako znaju da ubodu u žicu, svaka im čast! Vrhunski film, ultra mega giga!",Positive,None,None,None,Positive,None,None
934,"Hvala na pohvali, a što se filma tiče, ko ga ne shvati, nije ga ni vredan ;)",None,None,None,None,Positive,Positive,None
935,"Fantastičan film, samo čovek treba da bude dovoljno otvoren da bi ga shvatio kako treba. I super recenzija!",None,None,None,None,Positive,Positive,None
936,odličan film... jako dirljiv :),None,None,None,None,Positive,None,None
937,"trenutak kada odsvira bumbarov let u kafiću, a svi skupljaju vilice po podu... neprocenjivo!",Positive,None,None,None,Positive,None,None
938,"Nisam gledao, a ni truditi se neću. Posle onakvih nemaštovitih i glupih stvari iz prvog dela, ne pada mi na pamet da na ovo potrošim minute svog života (I ovako kažete da je prvi film isti kao i drugi).",None,None,None,None,Negative,None,None
939,slažem se. :),None,None,None,None,None,Positive,None
941,"obožavam i prvi i drugi deo, nadam se da će nastaviti sa delovima 10/10",None,None,None,None,Positive,None,None
942,"aurena i tijana.. slažem se, II deo - katastrofa",None,None,None,None,None,Positive,None
943,Slažem se sa Tijanom film je očajan a prvi je prava komedija,None,None,None,None,Negative,Positive,None
944,"film je mnogo lošiji od prvog dela, na čije sam se scene cepala od smeha. Razočarenje.",None,None,None,None,Negative,None,None
945,"Iskreno, jako sam se plašila kako će ispasti drugi deo, da se ne razočaram, jer mi je prvi definitivno omiljena komedija, koju mogu 300 puta da gledam i uvek se smejem.",None,None,None,None,Positive,None,None
946,"Odlična ideja koja nije dovoljno razrađena a ubijena je malo i nekim klišeima, kao što je ruska mafija.",Negative,None,None,None,Neutral,None,None
947,od mene može i 7 jer je ipak zanimljiv film i drži pažnju,None,None,None,None,Positive,None,None
948,slažem se sa Goranom. Pišeš dobre recenzije filmova. Nastavi u ovakvom stilu.,None,None,None,None,None,Positive,None
949,"Da, apeluje hard core Depp-ovim fanovima. Realno, jedino je prvi deo zanimljiv dok kvalitet drastično opada kod svakog narednog dela. Ne vidim kako ovo i The Tree of Life mogu biti ista ocena.",None,None,None,None,Neutral,None,None
951,"Previsoka ocena, čak i za hardcore Deppovog fana poput tebe.",None,None,None,None,Neutral,Negative,None
952,najbolje! samo da su ubacili koju sex scenu bilo bi dobro.,None,None,None,None,Neutral,None,None
953,"Ovaj film sigurno nije ništa novo i revolucionarno, ali ako si uživala u prethodnim delovima, smatram da je ovo adekvatan i dostojan nastavak, da se još malo više družiš sa ovim dragim likovima... ali voliš, ili ne voliš!",None,None,None,None,Neutral,None,None
954,"Meni možeš Džonija da pustiš kako ništa ne radi, i opet bi mi bilo interesantno, ali nekako mislim da je ovo samo ''silovanje'' franšize zarad šake dolara :D But, naučila sam da ti verujem, znaš ti zbog čega, paaaa... gledaćemo ;)",None,None,Positive,None,Negative,Neutral,None
955,"Deluje mnogo zanimljivo... kao i svaki prezauzet roditelj, imam strahovanja da decu zapostavljam i ne nudim dovoljno ljubavi i pažnje.",None,None,None,None,Positive,None,None
956,"filozofski dubokoumnim i mudrim, svakako morate bar videti njegov rad kao izuzetno kompleksnim i otvorenim za višestruko tumačenje, baš kao dobro napisan haiku. WORD",None,Positive,None,None,None,None,None
957,Jedan od boljih.,None,None,None,None,Positive,None,None
958,molio bih recenziju filma dženifer osam sa Endi Garsijom sjajan triler,None,None,None,None,Positive,None,None
959,"Upravo tako, odličan film koji zaslužuje 10 !",None,None,None,None,Positive,Positive,None
960,zašto ovaj film nije poznatiji? zaslužuje mnogo više pažnje s obzirom na kvalitet i na sasvim dobru glumačku ekipu,None,None,Positive,None,Positive,None,None
961,"Fantastičan film, neverovatna priča, gluma. Nisam nešto bio ljubitelj Kevina Spejsija pre, međutim tek sad vidim o kakvom velikom glumcu se radi. Po mom skromnom mišljenju ocena 10/10",Positive,None,Positive,None,Positive,None,None
962,Mislio sam da će ocena biti 10/10 :) Trebao si da spomeneš fantastični soundtrack.,None,None,None,Positive,None,Negative,None
966,"Gledao, nikako da stignem recenziju da uradim... fantastičan film! Biće uskoro...",None,None,None,None,Positive,None,None
967,"Ako film probudi nešto u tebi, to samo znači da je kvalitetno urađen. Dobra pozadinska priča i dobar reditelj je svakako recept za uspeh. Bez obzira da li se radi o igranom ili dokumentarnom filmu. Pravi primer za ovo (pored ovog filma) i Exit Through the Gift Shop http://www.imdb.com/title/tt1587707/",Positive,Positive,None,None,Positive,None,None
968,"Roberte, nisi obratio pažnju, ali u svim medijima, na našoj Fb stranici i beleškama stoji da je film dokumentarni, čak je dan ranije otvorio beogradski festival dokumentarnog filma BELDOKS! Sve o filmu stoji u našim beleškama! srdačan pozdrav",None,None,None,None,None,Negative,None
969,super film i nažalost poslednja uloga tragično nastradalog Brendona Lija i to baš na snimanju ovog filma,None,None,None,None,Positive,None,None
970,Stvarno odličan film.. gledao sam više puta.. ostale delove nisam.. mada sam čuo da nisu nešto...,None,None,None,None,Positive,None,None
971,"Kao što ti reče, apsolutni klasik! Fenomenalan film, preteča svim ostalim holivudskim, da kažem kurajberima! Stiv, dasa i po, pravi drot! A da tek jurnjava, to je posebna pričica! Takođe bih preporučio Vanishing Point (1971), isto jurnjava kolima, ali sve real-time, nema zajebancije!",Positive,Positive,Positive,None,Positive,None,None
972,presladak film.,None,None,None,None,Positive,None,None
973,"treba prvo proveriti resurse nego što se usudiš da kometarišeš, ali no dobro",None,None,None,None,None,Negative,None
974,Boki grešiš. Film je rađen stop motion tehnikom i nikako drugačije. O tome se možeš na primer uveriti i ovde: http://www.youtube.com/watch?v=e5uKeOolfTc,None,None,None,None,None,Negative,None
975,Ozbiljno ti kažem da se posvetiš čitanju stripova da bi što se ovoga tiče mogao da pišeš iole realne recenzije.. a da ne pominjem istraživačke radove oko ostalih filmova koje si bukvalno unakazio svojom neinformisanošću..,None,None,None,None,None,Negative,None
976,isto... ali nije mi dorastao očekivanja,None,None,None,None,Negative,Positive,None
977,"Jao! Jedva čekam da ga odgledam, mada sam posle tvoje recenzije malo skeptičan. Obožavam ovu vrstu filmova!",None,None,None,None,Neutral,None,None
978,"E, bukvalno sam to pomislila!!! :))) Ako bismo ""Friends with benefits"" okarakterisali kao simpatičan osrednji filmić, ovaj bi bio osrednji - bez simpatičan. Radnja - nategnuta. Postupci -nemotivisani. U neko doba me zabolela glava od gluposti i migrena je jedina ""ženska dimenzija"" koju sam uspela da pronađem. Khm, Gorane :)",Negative,None,None,None,Negative,Positive,None
979,bolji je friends with benefits. sličan film al' bolji glumci i više sex scena.,None,None,None,None,Positive,None,None
980,Nah! Meni se film baš svideo i skroz sam se lepo ismejala! Odličan za nedeljno popodne 8/10,Positive,None,None,None,Positive,None,None
981,Preporuka i sa moje strane :),None,None,None,None,Positive,None,None
982,"U potpunosti se slažem, ali bar je tu film da edukuje one koji na ovakve stvari ne obraćaju pažnju!",None,None,None,None,Positive,Positive,None
983,"Odličan film o malo poznatim dešavanjima u Ruandi tih godina, kada je Bosna bila ""centar medijske pažnje"". Na kraju ostaje prilično gorak osećaj... Nisu sve žrtve iste. Jedno su Evropljani, drugo su Afrikanci. Licemerje svetskih sila.",Positive,None,None,None,Positive,None,None
984,Ovaj film je najveće razočarenje za sve ljubitelje Sci-Fi. Ocena 3-4 je max za ovu glupost od filma.,None,None,None,None,Negative,None,None
985,"Ovom filmu 4/10 možda i to je mnogo. Efekti su kul ali me onaj lik što snima smorio, idiot jedan. U 3D će biti zanimljivo ali ovako ništa. Onog lika da izbace u sledećem filmu. Budala blesava!",Negative,None,None,None,None,None,Positive
986,"Pohvaliti ovo g**no od filma, a onako popljuvati Avatar i još neke filmove.. druže, mani se ti recenzija, nije to za tebe :) Iako smatram da su ukusi različiti, tako takođe smatram da treba da nađeš drugi posao, znaš, neki pravi posao :)",None,None,None,None,Negative,Negative,None
987,"Poražavajuće je za jedan mockumentary da nema scenu rotiranja kamere za 360 stepeni, kao što je autogol savršen kadar čudovišta koje devastira Menhetn. To su nedopustive stvari za film koji insistira na autentičnosti.",None,Negative,None,None,Negative,None,None
988,"treba ponovo šansu da mu daš, možda samo ovog puta da se više skoncentrišeš, udubiš, isključiš ostale distrakcije, jer je ključ doživljaja, da se suživiš sa panikom te vanredne situacije, zato je i snimano iz trećeg lica.",None,Positive,None,None,None,Negative,None
989,"Auuuu, kakav film. Ostavio jak utisak na mene.",None,None,None,None,Positive,None,None
990,"Zaista odličan film, iako je na momente malo težak, Naziv filma bi se, inače, mogao prevesti kao zgarišta, što je verovatno u vezi se sirotištem u koje je otac/sin Nihat Maj bio ostavljen, a njegovim spaljivanjem je zapravo i počela sva drama glavne junakinje.",None,None,None,None,Positive,None,None
991,"Film je fenomenalan, možeš li mi samo reći molim te kako se tačno prevodi reč Incendies. Meni daje prevod vatra a to mi baš i nije logično.",None,None,None,None,Positive,None,None
993,"Drago mi je da pratiš, hvala puno na lepim rečima.",None,None,None,None,None,Positive,None
994,OVO SE PRIMA INTRAVENOZNO!! Na momente sam potpuno gubila osećaj da je to film.. TO JE ŽIVOT UŽIVO!! Veliko hvala na preporuci i divnoj recenziji :)),Positive,None,None,None,Positive,None,None
995,"Auf, odličan film! Surovost života, a istovremeno i njegova lepota! Nego, hteo sam da ti preporučim od Inaritua film ""Babel"" (2006), takođe vrhunski!",Positive,None,None,None,Positive,None,None
996,"slažem se, dosta znači taj realni pristup snimanja, čini čitav projekat mnogo kvalitetnijim",None,Positive,None,None,None,Positive,None
997,stvarno odličan.... posebno me je oduševio detalj u filmu kako je njegov natprirodni dar ubačen u film nekako prirodno u pozadini tako da uopšte ne izbija u prvi plan što bi uveliko odvuklo film na neku drugu stranu...,Positive,None,None,None,Positive,None,None
998,sjajan film obožavam Kim Bejsindžer od mene 10,None,None,Positive,None,Positive,None,None
999,"Odličan film, ali sa toliko mnogo likova i toliko zakomplikovanom pričom da sam nekoliko puta morao da ga premotavam unazad i da pročitam par tekstova sa interneta da bih uspeo sve da povežem. Od mene ocena 9/10.",Neutral,None,None,None,Positive,None,None
0,"Jako dugo sam čekao ovaj film i odgledavši ga mogu reći da je SAVRŠEN ! Svaki detalj je savršeno urađen, od slike, muzika, likova! Svaka preporuka! :)",None,Positive,Positive,Positive,Positive,None,Positive
1,"Za ovo se apsolutno slažem. Odličan film i odlična fotografija, ko želi da ga odgleda neka to učini sa najboljim kvalitetom slike.",None,None,None,None,Positive,Positive,Positive
2,"slažem se sa svim napisanim, gatsby sa robertom redfordom je savršen, jedino što valja kod ovog je fotografija i kostimi",None,None,None,None,None,None,Positive
3,"Ovaj film obožavam, zbog Odri, muzike, neobično ispričane priče, fotografije... I, da TOTU je, a ne TaTU.",Positive,None,Positive,Positive,Positive,None,Positive
5,"Ja sam se ovom baš bio radovao, ali je zaista po svim pitanjima nesnosan.",None,None,None,None,Negative,None,None
9,"gledao ga pre godinu, fantastičan film, često ga se setim :D",None,None,None,None,Positive,None,None
17,"Film je predivan, čak i za višu ocenu.",None,None,None,None,Positive,None,None
18,"Gledljiv film koji ne pruža ništa više od toga, a i ne očekujem od takvih filmova neki posebni kvalitet gde je većina stvari generički odrađena.",None,None,None,None,Neutral,None,None
19,"Odlično napisana recenzija! U potpunosti se slažem. Film solidno gura negde malo više od polovine a onda se načisto raspadne. Ne preporučujem film za gledanje u bioskopu, upravo zbog samog kraja gde mi je baš zbog te ""sramote"" bilo žao što sam platio ulaznicu.",None,None,None,None,Negative,Positive,None
21,Sjajan film! Hvala za recenziju Sandra.,None,None,None,None,Positive,None,None
22,"Odavno nisam gledao gore smeće.... nema to nikakve veze sa nacionalnom pripadnošću, e moj Roberte... mrlja u karijeri...",None,None,Negative,None,Negative,None,None
24,"Ja zaista obožavam da se smejem glupim filmovima, ali ono što razlikuje ovaj treš od mnogih, jeste to što ""Killing Season"" sebe prilično ozbiljno doživljava, stoga je taj faktor samoismevanja nepostojeći, a onda kada se uoči da se nisu zezali, sve nekako postaje otužno.",None,None,None,None,Negative,None,None
25,"Film je treš, toliko loš da je u stvari odličan. Drago mi je da sam te nasmejao, taman srećan da spavaš noćas xD",None,None,None,None,Negative,None,None
26,"Džontra je u ovom filmu baš ono ""da nije smešno bilo bi tužno"".. Ali ovaj komentar i ocena su samo smešni.. :)",None,None,Negative,None,None,None,None
29,"Odličan film, topla preporuka!",None,None,None,None,Positive,None,None
31,Odličan film i recenzija. Samo nastavite tako.,None,None,None,None,Positive,Positive,None
32,Izvini Sandra nisam video i zahvaljujem se na sjajnoj recenziji i samo nastavi tako :))),None,None,None,None,None,Positive,None
35,Moj omiljeni glumac u omiljenoj ulozi. Gledanje ovog filma mi daje snage i pozitivnog adrenalina.,None,None,None,None,Positive,None,None
36,jedan sjajan klasik legendarnog klinta istvuda uloga prljavog inspektora Harija i rečenica koja se pamti make my day,None,None,None,None,Positive,None,None
37,"nije loše za opuštanje, malo smeha i malo Anistonova (kao striperka), fino dok ne upada u kliše američke komedije!",None,None,Positive,None,Neutral,None,None
38,"očajan film, kec zabetoniran za sva vremena, kakva crna šestica!",None,None,None,None,Negative,None,None
39,Mnogo smešno!!! Dženifer je doprinela više nego dovoljno... :) Pogledati! 8/10,None,None,Positive,None,Positive,None,None
40,"solidna komedija, ništa specijalno ali za nedeljno popodne ili neko veče sasvim ok. gluma slaba, deca su mi daleko bolja, Rejčel i Džejson nekako usiljeni. Slažem se 6/10",None,None,Negative,None,Neutral,None,None
41,Ovo je filmčina i po...,None,None,None,None,Positive,None,None
42,"gledala sam davno film, možda godinu dana nakon što se pojavio ali ostao mi je urezan u sećanju, pogotovo ona scena kada sanja da leti ka obali uz muziku karuza... prekrasan film, jedna dirljiva priča, jedan od najboljih filmova obojice",None,None,None,None,Positive,None,None
44,"Havijer Bardem me je prijatno iznenadio u filmu: Biutiful, i zato jedva čekam da pogledam i ovaj film. :)",None,None,Positive,None,None,None,None
52,Genijalan :),None,None,None,None,Positive,None,None
53,Brutalan film!,None,None,None,None,Positive,None,None
54,Izvrstan film!!!!,None,None,None,None,Positive,None,None
55,"Gael Garsija Bernal, mi je jedan od omiljenih glumaca, nekako je simpatičan i ima neku harizmu.",None,None,Positive,None,None,None,None
56,e ovo je filmčina !,None,None,None,None,Positive,None,None
57,"Predivan film! Poučan, maštovit i likovi su savršeni, nijedan lik nije dobar ili loš, to je ono što najviše volim u japanskim crtaćima.",None,None,None,None,Positive,None,None
59,"Uz Akiru, po mom mišljenju, najbolji manga crtani film svih vremena.",None,None,None,None,Positive,None,None
60,Nemam šta da dodam ili oduzmem recenziji.,None,None,None,None,None,Positive,None
61,"Opalim te golim :) film je super, glumci odlični, recenzija na mestu!",None,None,Positive,None,Positive,Positive,None
64,Film je čuuuudo!!!,None,None,None,None,Positive,None,None
65,"Najbolji ratni film svih vremena. Odgledao sam tu najdužu verziju, od 5 sati, i neverovatno kako je to prošlo. Ma čista genijalnost, savršeno po svim tačkama, od akcije do drame. Nema se šta drugo reći osim najbolji.",None,None,None,None,Positive,None,None
66,"Odličan film, kao i svaki Danski koji sam gledao do sada. Ono što me fascinira kod danaca je to što su toliko hladni, tj. ne iskazuju osećanja ni približno kao mi...",None,None,None,None,Positive,None,None
67,"meni je ovo jedan od najomiljenijih španskih filmova. sjajan triler, drži pažnju sve vreme!",None,None,None,None,Positive,None,None
68,"Ja kao laik mislim da se izgovara sa nečujnim e (Žne), a Odri je Totu. :) Inače jedan od omiljenih filmova, kod koga se mogu zatvoriti oči i slušati soundtrack i skočiti u bunar mašte.",None,None,None,Positive,Positive,None,None
71,Спада у мојих топ 5. филмова.,None,None,None,None,Positive,None,None
72,"Odlična recenzija, u potpunosti se slažem da je film pravo umetničko delo u svakom pogledu. Svako ko sebe smatra ljubiteljem filma nikako ne bi trebao da ga propusti. Odgledao sam ga nekoliko puta i svaki put sam uživao kao da ga gledam prvi put. Film je naprosto čaroban!!!",None,None,None,None,Positive,Positive,None
73,"Fenomenalan kao i prvi deo! Rasprava o Gospodaru prstena i Ratovima zvezda je odlična, svaki put me nasmeje, kao i sve ostalo :))) Hvala na recenziji!",None,None,None,None,Positive,None,None
74,Urnebesno i unikatno! 9/10,None,None,None,None,Positive,None,None
75,"Ha! Legendaran film i odlična recenzija! Mallrats pod hitno da se gleda, to je definitivno (duhovni) nastavak ovog, sva sreća - nebrušenog, dijamanta!",None,None,None,None,Positive,Positive,None
78,Da nije Hju Džekmana ne znam koliko bi sve ovo ovako izgledalo. On kao da živi život Vulverina.,None,None,Positive,None,None,None,None
79,"Prvi film o Vučku je definitivno najvredniji pažnje u meri koliko ovaj to nije, ovo je tipična holivudska ""brza hrana"", loše!",None,None,None,None,Negative,None,None
80,"Sama priča filma je ok..... ali su ga uspeli uništiti krajem, jedina stvar koja mi je privukla pažnju je dodatna završna scena gde se Magneto i Profesor X pojavljuju, koja je u suštini najava za predstojeći X man film... sve u svemu 5/10",Neutral,None,None,None,Neutral,None,None
82,"Ne znam, meni je prvi film o Wukiju mnogo bolji nego ovaj... Pogotovo što obiluje nekim nerealnim čudnim scenama. Kraj oba filma je overkill ali tamo ima bar neku logiku, ovde onako.... U svakom slučaju nije loš ali je lošiji od sva tri dela Xmen-a",None,None,None,None,Neutral,None,None
83,"Odgledao sam film, onda pročitao recenziju! Fil je super, a Mekonahi i 2 klinca razbijaju.",None,None,Positive,None,Positive,None,None
84,"Mud“ je film bez skoro ikakvog pulsa. Čak i kada se ispaljuju hici, intenzitet radnje, sa njom i naša pažnja, ostaju uljuljkani. ""... sve je rečeno u ove dve rečenice po meni... previše statično...",None,None,None,None,Negative,None,None
85,Ja sam sve ubeđenija da ovaj Mekonahi i onaj što je ostavljao devojku za 10 dana nisu ista osoba. :D Divan film. P.S. Ako bude mogla u skorije vreme neka recenzija Take Shelter jer me mrzi da ljudima objašnjavam zašto treba da gledaju film.,None,None,None,None,Positive,None,None
86,odličan film!!,None,None,None,None,Positive,None,None
87,Sećam se ovog filma. Odličan.,None,None,None,None,Positive,None,None
88,"Prosto ne mogu da verujem, da sam ovaj film propustio da odgledam, s obzirom da je snimljen 2007. godine. Za svaku preporuku, pravi triler, koji vas nokautira u poslednjih nekoliko scena.",None,None,None,None,Positive,None,None
90,Kad se setim Blejda ovo je veliki promašaj.......,None,None,None,None,Negative,None,None
91,"5 od 10? Čekam film toliko godina, još sa njim, a on je opet usamljeni borac protiv nemrtvih, ah, rings any bell? Dala bih mu možda 2.5/10",None,None,None,None,Negative,None,None
92,Odličan film...,None,None,None,None,Positive,None,None
93,"Meni je lično draži Sunset od Sunrise. Ali cenim mišljenje, dobra recenzija.",None,None,None,None,None,Positive,None
94,Nije on toliko loš koliko ne može da se otarasi Jax-a... generalno igra jednu te istu ulogu kroz ceo SoA i filmove koje snima za vreme serije. Ali tamo je odličan. I ima fenomenalan naratorski glas.,None,None,Neutral,None,None,None,None
95,Nije se istakao ni dobrom ni lošom glumom. Nije bilo razloga da ga posebno pominjem.,None,None,Neutral,None,None,None,None
96,A ništa od Idris Elbi najjačem glumcu u celom filmu i najperspektivnijem glumcu kojeg trenutno ima u hollywoodu loše loše to da izostaviš vidiš ništa bolji nisi :D ključne segmente izostavljaš,None,None,Positive,None,None,None,None
100,"Sjajan film, jedan od inicijalnih ovog izuzetnog režisera. Hvala za recenziju.",None,Positive,None,None,Positive,None,None
101,"Odgledan kad i ostali Hičkokovi filmovi, pre nekoliko decenija. Remek delo.",None,None,None,None,Positive,None,None
104,Remek delo. Tačka!,None,None,None,None,Positive,None,None
106,"Ne bih da smaram, ali u filmu ""Rope"" ima nekoliko rezova u vidu suptilnih zatamnjenja. I taj je film sjajan. Možda ne spada u Hičkokov ""best of"", ali ga svakom preporučujem. Pozdrav.",None,Positive,None,None,Positive,None,None
107,"Филм је генијалан a нарочито бриљира Џејмс Стјуарт, који је нешто најбоље што је Холивуд изнедрио. Што се тиче Хичкокових филмова више од овога ми се свиђају само North by Northwest и Vertigo",None,Positive,Positive,None,Positive,None,None
108,"Jako neobična recenzija, više kao esej. U svakom slučaju vidi se stručnost autora. Svaka čast",None,None,None,None,None,Positive,None
109,Sve pohvale autoru recenzije. Film je zasluženo masterpiece.,None,None,None,None,Positive,Positive,None
112,Svaka čast za tekst.,None,None,None,None,None,Positive,None
113,odličan horor odavno se nisam ovako iscimao.,None,None,None,None,Positive,None,None
116,gledljiv je. slažem se sa recenzijom i ocenom.,None,None,None,None,Positive,Positive,None
118,"Gledao sam ga više puta, dobar film. :)",None,None,None,None,Positive,None,None
120,"Sjajan film, definitivno spada u top 10 mojih omiljenih...",None,None,None,None,Positive,None,None
122,"Razočaran sam filmom, neverovatno isprazna priča, sa elementima predvidivim od početka do kraja. Kvare draž dobrih stripova, nadam se da više neće uništavati druge stripove svojim adaptacijama, a Dark Horse ima poprilično dobru kolekciju :)",None,None,None,None,Negative,None,None
123,"odličan film, molio bih recenziju filma ptica na žici sa Mel Gibsonom i Goldi holm u glavnim ulogama meni je taj film sjajan",None,None,None,None,Positive,None,None
124,"Baš sam i ja skoro gledao film, i planiram da pogledam čitavu trilogiju. od mene 7.",None,None,None,None,Positive,None,None
125,Istinski klasik iz zlatnog perioda akcionih filmova,None,None,None,None,Positive,None,None
127,Odličan film sa uvek savršenim Havijerom Bardemom.,None,None,Positive,None,Positive,None,None
128,Odličan film!,None,None,None,None,Positive,None,None
130,"Before sunrise i Before sunset... oba odlična, oba ovde recenzirana! Kao i ovaj, mada je ovaj možda za nijansu slabiji ali je takođe vrlo dobro uklopljen u trilogiju.",None,None,None,None,Positive,None,None
140,"Jedanput sam ga slučajno uhvatio na TV-u, i privukao mi je pažnju prvo radom kamere, a onda i jako zanimljivim dijalozima. Sasvim dobar film, i jako dobra recenzija.",None,Positive,None,None,Positive,Positive,None
141,"Ne mogu da verujem da smo se konačno složili u nečemu!!!! Film je minimalističko remek delo, Hawke i Delpy briljiraju. Obavezno pogledati i nastavak Before Sunset, ništa lošiji ako ne i bolji!!! Ovaj treći deo Before Midnight nisam gledao ali uskoro ću, mada me nešto strah da se ne razočaram...",None,None,Positive,None,Positive,Positive,None
142,"Stvarno prekrasan film, onako minimalistički urađen skroz nepretenciozan baš kakve ja volim xD...",None,None,None,None,Positive,None,None
143,"ja ne znam jesmo mi gledali isti film, ali je meni bio toliko loš da ga nisam uspeo do kraja pogledati",None,None,None,None,Negative,None,None
144,"Au kako čudan film. Ima sve elemente da bude ok, ali nije. Prosto mu nešto fali. Mislim da to najbolje objašnjava poslednja rečenica recenzije. Od mene 5/10.",None,None,None,None,Neutral,None,None
146,"Konj je najbolje odigrao ulogu, hvala Zadovoljan recenzijom.",None,None,Negative,None,None,Positive,None
147,ovo je fantastičan erotski triler i ne zaslužuje ocenu 5,None,None,None,None,Positive,None,None
148,"Malo reći kultni film, recenzija promašaj",None,None,None,None,Positive,Negative,None
149,Moram da priznam da mi je Basic Instict 2 više ostao u sećanju. Šeronka tu izgleda opasno a i film je sve u svemu vrlo gledljiv. Naravno nema matorog Daglasa,None,None,None,None,Positive,None,None
151,"Pravi ljubitelji horor filma bi trebalo itekako da preskoče ovo. Film je naivan, dosadan kao i većina ovakvih projekata sa tinejdžerima u šumi. Likovi su smešni, gluma očajna, previše naivno. Film za malu decu.",None,None,Negative,None,Negative,None,None
