,text,Radnja,Rezija,Gluma,Muzika,Opsti utisak film,Opsti utisak komentar,Specijalni efekti
137,"Odličan! Inače sam za Temple čula i ranije, pošto su njene inovacije kudikamo olakšale patnje životinja u ""livestock"" industriji, a gledala sam i BBC Horizon dokumentarac o njoj.. Neverovatna osoba. A za Kler Dejns desetka ""k'o vrata"" za ulogu. Povlačim sve ružno što sam rekla za njenu glumu. :)",None,None,Positive,None,Positive,None,None
138,svim ljubiteljima Vreline preporučio bih To Live And Die in La. nema glumačke veličine kao što su De Niro i Paćino ali je sjajan http://www.imdb.com/title/tt0090180,None,None,Positive,None,Positive,None,None
139,neću ništa reći sem odličan film.,None,None,None,None,Positive,None,None
141,"Pa daj ako je spektakularna makar 9 :D Inače film je stvarno odličan, rekao bih da može da se svrsta među kultne :D",None,None,None,None,Positive,None,None
142,mora da se šalite. ovo je jedan od najglupljih filmova koje sam ikada pogledao.,None,None,None,None,Negative,None,None
143,"Odgledao film, odgledao drugi put, odgledao treći put :D Nisam mogao odjednom pohvatati svu tu moćnost :D Film je maestralan! Dajte još kakav dobar film, na ovaj fazon",None,None,None,None,Positive,None,None
144,"da, šokantno je smor",None,None,None,None,Negative,Positive,None
145,"Jaoooo, glupog li filma!!! Uglavnom svarim ove chick flick, ali ovaj teško!!!",None,None,None,None,Negative,None,None
146,"Izuzetan film! 8 je neki minimum što se tiče ocene sa moje strane, definitivno vredi pogledati.",None,None,None,None,Positive,None,None
148,"Fenomenalno!!! Ništa originalnije se nije pojavilo u skorije vreme!!! Mnoge poruke upravo i proizilaze iz besmisla... Veoma duhovito, zanimljivo i na momente toliko apsurdno i smorno da ne može da bude zanimljivije i bolje :) ""NO REASON"" - Preporuka!",Positive,None,None,None,Positive,None,None
149,"Može biti i po meni jeste veoma, veoma loše.",None,None,None,None,Negative,None,None
151,"Sjajan film, ne sećam se kad sam se poslednji put ovoliko iznervirao zbog nečega što se dešava na ekranu. Obavezno ga pogledajte čak i ako vas nerviraju ostali filmovi Dejvida Linča, kao što je kod mene bio slučaj :)",None,Neutral,None,None,Positive,None,None
152,"Odlična recenzija, samo jedna sugestija, Džozef Merik, ne Džon Maverik :)",None,None,None,None,None,Positive,None
153,"Po mom skromnom mišljenju, najbolji film koji sam pogledao... zaista 10/10 !!!",None,None,None,None,Positive,None,None
154,"Konačno jedan film od D. Linča koji nema neke velike misterije niti onog ''šta je pisac hteo da kaže''. Film je odličan, poseduje onu težinu koja je ''prepoznatljiva'' samo u njegovim filmovima. Šta je lepota? Da li je to samo ono što vidimo ili ''što nam se kaže''? Preporučujem!",None,Neutral,None,None,Positive,None,None
155,Ovo je film koji se prosto mora pogledati :),None,None,None,None,Positive,None,None
156,"divan film, vredan foresta gampa.",None,None,None,None,Positive,None,None
158,film za obožavanje!,None,None,None,None,Positive,None,None
159,"pa da, problem je radnja i uopšte poruka i utisak filma... likovi jesu zanimljivi, gluma jeste odlična, ali priča bukvalno nigde ne vodi...",Negative,None,Positive,None,Negative,Positive,None
160,"Ovakvi filmovi koji imaju zamišljenu radnju ali se u stvari ne radi ni o čemu, oduvek su mi bili dosadni. To što sam ga odgledala do kraja pripisujem samo odličnoj glumi. Ovo je jedan od filmova ""ako baš baš BAAAŠ nemate ništa pametnije da radite"".",Negative,None,Positive,None,Negative,None,None
162,"Pogledao sam prva dva dela i oduševio me je, prosto sam bio iznenađen. Treći deo nisam stigao da pogledam, ali posle ovog opisa ću morati u skorije vreme.",None,None,None,None,Positive,None,None
163,"Odličan završetak trilogije.. mislim da je super stvar što su prvi i treći deo ostavili najbolji utisak, pošto u ovakvim situacijama zna kvalitet vremenom da se kvari i da želja za zaradom preovlada. Ali ipak to se nije desilo i nisu nas razočarali.",None,None,None,None,Positive,None,None
164,"Slažem se, vredi pogledati!",None,None,None,None,None,Positive,None
165,sjajan film,None,None,None,None,Positive,None,None
166,"Uh, ovo je film sa velikim f! Odlična recenzija!",None,None,None,None,Positive,Positive,None
168,Odličan film! recenzija skroz na mestu. :),None,None,None,None,Positive,Positive,None
169,"obavezno, odličan je ! :)",None,None,None,None,Positive,None,None
172,"Pomalo mi je krivo što si ovakvom filmu dao 8/10 a ""klip""-u 10/10.. iako si već obrazložio svoj način davanja ocena.. U svakom slučaju fala na recenziji, možda bi se desila velika kosmička nepravda da ne odgledam ovaj film da nisam pročitao recenziju na ovom sajtu.. :) poz",None,None,None,None,Positive,Negative,None
173,"Šta reći za ovakvo delo. Sjajna dubokoumna priča, praćena sjajnom glumačkom ekipom! Ne pamtim film koji mi je krajem toliko oduzeo dah kao ovaj! 10/10",Positive,None,Positive,None,Positive,None,None
175,"malo stavki, ali zato su sve izuzetno kvalitetne :)",None,None,None,None,None,Positive,None
176,"Film je vredan svake minute prosto nemam reči. Tako jednostavno a neverovatno zanimljiv, dubok. Svaka preporuka sa moje strane.",None,None,None,None,Positive,None,None
177,"Prvenstveno sam zadovoljan krajem, pošto kao i u čitavom svojem trajanju uspeo je da odoli klišeima raznim... jeste nekonvencionalan film, ali svako kvalitetan, a za pravu publiku i fantastičan :)",None,None,None,None,Positive,None,None
178,Meni se svideo... javi,None,None,None,None,Positive,None,None
181,"Meni je skroz ok, ovo je malko laganiji okret na čitavu tu situaciju.... sviđa mi se što ne pokušava da istakne toliko ratnu situaciju...",None,None,None,None,Positive,None,None
182,"Robin Williams je stvarno kul, svaka mu čast.. al što se tiče celog projekta, malo sam se razočarao, očekivao sam da ima zanimljivijih dešavanja, po mom mišljenju fali radnje.",Negative,None,Positive,None,None,None,None
183,lepa slika.... njesra i scenario i gluma,Negative,None,Negative,None,None,None,Positive
184,loš loš film.....!!!!,None,None,None,None,Negative,None,None
185,Ne mislim loše o ovom filmu ali moram da priznam da mi je bio dosadan. Ništa novo ni naročito zanimljivo. Uzgred budi rečeno lik Totoa na kraju nema nikakvih dodirnih tačaka sa likom iz mladosti.,None,None,None,None,Neutral,None,None
186,moj omiljeni film...,None,None,None,None,Positive,None,None
187,Remek delo u svakom smislu !,None,None,None,None,Positive,None,None
189,Bez veze film! Toliko opštih mesta...,None,None,None,None,Negative,None,None
190,http://www.youtube.com/watch?v=RwDf2DCX_1A Savršen film!,None,None,None,None,Positive,None,None
192,upravo ga odgledao. stvarno remek delo btw čestitam na svim ovim novostima,None,None,None,None,Positive,None,None
194,"Ja obožavam ovoga glumca, pogotovo u filmu: Amores Perros. :)",None,None,Positive,None,None,None,None
195,"A kad se prikazivao kod nas u bioskopu ja i još jedan klinac, živ me strah pojeo od prazne sale. Slažem se sa komentarom, jako lepo ali pre liči na uvertiru nego na operu ;)",None,None,None,None,None,Positive,None
196,"Meni se sviđa prvenstveno što je fokus na ranoj fazi njegovog života i dela, bez one već hiljade puta viđene ratne tematike. Pored sjajnih pejzaža, jako mi se i svidela sama atmosfera u filmu.. ne znam, ja sam prezadovoljan, nevezano za kasnija politička angažovanja i stavove.",Positive,None,None,None,Positive,None,Positive
197,solidan mi je film ume Stajtam mnogo bolje,None,None,Neutral,None,Neutral,None,None
198,"Slažem se potpuno sa recenzijom, batalite rimejk, gledajte verziju iz 1972 sa Charles Bronsan-om i Jan-Michel Vincetom!",None,None,None,None,None,Positive,None
199,Ista ocena kao i mišljenje. Samo ostaje neverovatno da filmovi poput ovog su veoma gledani na internet online sajtovima. To bi moglo da se objasni jedino klasičnim odnosom 80% 20% u korist lošeg sistema vrednosti većine ljudi kao i manjak inteligencije istih.,None,None,None,None,Negative,None,None
200,"Šteta, baš aljkavo odrađeno",None,None,None,None,Negative,None,None
201,Sve je rečeno u recenziji. Nemam ništa da dodam. Razočarenje.,None,None,None,None,Negative,Positive,None
202,scenografiju za film je Karpenter pravio za Escape From New York pa ju je ubrzo zatim onda koristio Ridli za ovaj film,Neutral,None,None,None,None,None,None
203,U potpunosti se slažem sa tobom. one in a million,None,None,None,None,None,Positive,None
205,A muzika koju je uradio Vangelis? Je l’ i to suvišna informacija? :),None,None,None,Neutral,None,None,None
208,"Još jedna odlična recenzija. Film je perverzan, OST isto tako, a knjiga? Zašto nisi spomenuo knjigu, sram te bilo.",None,None,None,None,Positive,Positive,None
210,"Ništa posebno, dosadniji film nisam gledala, ama baš ništa se ne događa... jedino mi sviđa priroda, i vikendica.",None,None,None,None,Negative,None,None
211,"Super filmić, totalno opuštajući :-) Fina komedijica!",None,None,None,None,Positive,None,None
212,Obožavam film... gledaću ga opet večeras! :) Nisam dugo...,None,None,None,None,Positive,None,None
213,Odličan film. :) Čak mi je i Carell bio simpatičan i gotivan. :),None,None,Positive,None,Positive,None,None
214,Šok nije umetnost!,None,None,None,None,Negative,None,None
215,"http://popboks.com/article/7202 ovde je još dobio i 9ku. Fazon, vraća veru u srpsku kinematografiju. Kapiram subjektivnost recenzija, al' ovo je nebo i zemlja.. :D",None,None,None,None,Positive,None,None
216,Odvratan film !!!,None,None,None,None,Negative,None,None
217,"Po meni jedan od najboljih srpskih filmova u poslednjih deset godina. Ne bih ulazio u dublja objašnjenja, ali po meni se ovaj film nikako ne sme propustiti. Ocena 9/10",None,None,None,None,Positive,None,None
218,"Film jeste šokantan, mada ne onoliko koliko je ''srpski film''. Nije mi jasna baš najbolje pouka filma... ali ipak moramo pohvaliti hrabrost reditelja i glumaca, film nije dosadan i opet je na neki način zabavan. Ne zaslužuje ocenu 10 mada mislim da je ocena 1 prestroga",None,Positive,Positive,None,Neutral,None,None
219,"Da, slažem se, hvala na pohvali! :) A baš sam želeo da mi se svidi",None,None,None,None,None,Positive,None
220,"Film je smešno loše urađen - bez trunke duha i umetnosti, odlična recenzija.",None,None,None,None,Negative,Positive,None
221,"Told you so! :) Isti princip i ja, automatski ga odmah odstranio! Jezivo jeftino!",None,None,None,None,Negative,None,None
222,"Vala baš. Meni je ovaj film od prve, pa do poslednje scene nekako otužan. Ta provokacija je toliko isforsirana i prenaglašena, kasting katastrofa, izrazito iritantni glavni protagonisti, zaplet banalan... Gomila treša sa samo jednim ciljem: da šokira. Odgledala jednom i obrisala sa harda.",Negative,None,Negative,None,Negative,None,None
223,"Film je do dela kad Dale gasi strugač i vadi klinca što je uskočio, zabavan i za čistu 7, od tog dela je reditelj verovatno izgubio kompas i film je bez veze.",None,None,None,None,Negative,None,None
225,"Sjajan, od mene 9 :D!",None,None,None,None,Positive,None,None
226,"super film, ismejao sam se za medalju... :) ovaj film je neuporedivo bolji od cabin in the woods, filma koji pripada istom žanru..",None,None,None,None,Positive,None,None
227,Nema komentara? Bilo bi stvarno šteta da ovaj film ostane nezapažen. Odlična zabava!,None,None,None,None,Positive,None,None
228,"odličan film, još bolja gluma, Gosling velikan na platnu već sada, treba pogledati svakako jer je netipičan film u odnosu šta nam se servira sve danas...",None,None,Positive,None,Positive,None,None
229,"Apsolutno sjajan film. Ne znam otkud tako loša ocena i ovoliko negativnih komentara. Film dosta dobro prikazuje vezu koja traje dugo, dugo a nije idealna.",None,None,None,None,Positive,None,None
230,Najrealniji i najiskreniji film koji se bavi tematikom muško-ženskih odnosa koji sam gledala do sada. Perfektna gluma glavnih likova. Gorane omašio si ovaj put :),None,None,Positive,None,Positive,Negative,None
231,predivan film.... gorak... težak... nije za svakoga i ne treba ni biti. meni u top 10 najdražih filmova u zadnjih nekoliko godina.,None,None,None,None,Positive,None,None
232,"Film kida koliko je dobar. Psihološka pozadina likova se samo u crticama nazire kroz te flashbackove: odrastanje, ambicije, ljubav i podrška koji iz porodice nisu došli a osnovni su element formiranja ličnosti.. Pazi, ima tu šta da se pročačka (kome legne film pa mu je do toga). Jedna fina osmica.",None,None,None,None,Positive,None,None
233,"meni je film ok. ipak vuče te da odgledaš do kraja, što je bitno.",None,None,None,None,Positive,None,None
234,"Film je i za mene bio totalno razočarenje, posebno sam bila bukvalno besna glavnim ženskim karakterom. Uopšte mi kao ženi nije jasno da neko može tako da se ponaša u vezi...",None,None,None,None,Negative,None,None
235,"Ma, ja bih mu dala još nižu ocenu ! Npr. 2 ! :)",None,None,None,None,Negative,None,None
236,"Krajnje zajeban film! Baš odličan! Velika filozofija o Jevrejskom pitanju! ""Šta je istina?"" - Pontije Pilat.",None,None,None,None,Positive,None,None
239,"Slažem se sa recenzijom i dodao bih, bar za mene, sjajnu muzičku podlogu iz koje bih posebno izdvojio Moby-a. Čitam blog već neko vreme a ovom prilikom pišem prvu poruku, kojom bih pozdravio autore.",None,None,None,Positive,None,Positive,None
240,Oduševio me film.,None,None,None,None,Positive,None,None
241,Sjajan!,None,None,None,None,Positive,None,None
242,Slažem se u potpunosti. Odličan film.,None,None,None,None,Positive,Positive,None
243,"poznata formula, poznati segmenti, a ipak odlično i efektno ukombinovani",None,None,None,None,Positive,None,None
244,"Ovaj film me je apsolutno iznenadio, zaista nisam očekivala da će biti toliko dobar. Zaista neizvesno i napeto, Rasel odlično glumi i film nije dosadan, nema beskrajno sporih momenata, bespotrebnih efekata, glupih dijaloga. Sve je po meri, i mislim da pogađa ono što i treba. Sve u svemu, odličan film.",Positive,None,Positive,None,Positive,None,Positive
245,Jedino prvi deo vredi...,None,None,None,None,Negative,None,None
246,"Ne znam kakvo će mišljenje imati fanovi, al meni uopšte ni jedan momenat nije bio smešan...",None,None,None,None,Negative,None,None
247,"Po meni film je totalni promašaj. Iako sam pre gledanja čuo loše komentare o njemu nisam očekivao da će biti tako loš. Komedija bi trebalo da bude smešna, ova to nije. Kao što je pomenuto u recenziji kvalitet humora je izuzetno slab.",None,None,None,None,Negative,None,None
249,Meni je film bio dosadan ! Bez ikakve akcije !,None,None,None,None,Negative,None,None
250,"Film je veoma dobar, vredi pogledati. :)",None,None,None,None,Positive,None,None
251,Odličan film!,None,None,None,None,Positive,None,None
254,"Hm, film je urbana bajka: na kraju pobeđuje pravda, pobeđuje najpametniji, najhumaniji pa i najlepši. I to žena, pa još i plavuša. Naravno, jer film ima i elemente naučne fantastike. Svideo mi se. Zaokuplja pažnju i drži je do samog kraja.",None,None,None,None,Positive,None,None
255,"Odlična ideja za film i jako zanimljiva prva polovina filma i nakon toga film postaje sporiji, kraj mi nije katastrofalan al nije ni dobar, svakako neočekivan al da je film obećavao jeste.. ocena 7/10",Positive,None,None,None,Neutral,None,None
256,"Odličan film, kraj jeste pomalo bez veze ali nije toliko loš kao što sam očekivao zbog ovog teksta.",None,None,None,None,Positive,Negative,None
257,"Po meni užasan film, konstantno presipanje iz šupljeg u prazno, teoretisanje bez ikakve logike i tako do samog kraja. Velika anti preporuka!",None,None,None,None,Negative,None,None
258,"sve je rečeno na kraju recenzije ""Ocena: sa 9/10 do pred poslednjih 10 minuta na jedva 5/10""",None,None,None,None,Negative,None,None
259,"kul je film, samo nisam skontala zašto je plavuša rekla tom naučniku: are you ready? onako tiho, kad je prošla pored njega. i što je on pomerao ono vreme.",None,None,None,None,Positive,None,None
260,jedan od najboljih filmova koje sam gledao u poslednje vreme. tačka.,None,None,None,None,Positive,None,None
261,"Krejvenov debi, Last House On The Left je bolji, zanimljiviji, realniji... original je snimljen 1972. a rimejk 2009. tako da je uspeh tog rimejka verovatno odgovoran za snimanje i ovog filma",None,Neutral,None,None,Positive,None,None
262,"Meni je film dobar, kako stara tako i ova nova verzija, iako ima nekih izmena u novoj verziji.. može se pogledati..",None,None,None,None,Positive,None,None
266,"Davno sam gledala original. Možda pogledam i rimejk, tek da vidim da li je išta bolje od originala - pošto je original bio apsolutni fejl i kultni exploitation treš. :)",None,None,None,None,Negative,None,None
270,"i mene se film dojmio... odlična priča, sve je tu dobro ispalo... koliko se sećam, ima neka priča i oko režisera, moram proveriti... film za preporuku... pozz iz bl... samo tako nastavi...",Positive,None,None,None,Positive,None,None
271,"Super je film, preporučujem ga svima.",None,None,None,None,Positive,None,None
272,"Da, možda sam to trebao naznačiti... svakako film ima previše kvaliteta, mislim da neće promeniti utisak! :)",None,None,None,None,Positive,None,None
273,Zaboravio si da kažeš da je glas robotu podario Kevin Spejsi koji je to maestralno odradio. Inače ovo je jedan od retkih filmova koje sam odgledao dva puta i to u roku od dva dana.,None,None,Positive,None,None,None,None
274,"Lično, mislim da film nije toliko loš. Veoma daleko od 10, ali makar za 6. Ideja je odlična, ali osnovni problem je što igra Džek Blek. On svaki film suviše iskrivi na komediju i svaki film mu je sličan sa ostalima. Generalno, on je loš glumac, ali odličan pozajmljivač glasa.",Positive,None,Negative,None,Neutral,None,None
275,Ovo je ispod svih mogućih standarda...,None,None,None,None,Negative,None,None
276,"obavezno pogledaj, film je više nego odličan",None,None,None,None,Positive,None,None
278,"Ta scena je sva u vezi muzike, koja je više nego fenomenalna! :) PS. Baš nisam odao mnogo, znaš i sam šta se sve izdešavalo! :) Psssst! :))",Positive,None,None,Positive,None,None,None
279,"Odličan! stvarno kul film, mislim da je dobra stvar što nisi mnogo stvari odavao :D za svaku pohvalu BTW scena sa takmičenjem je malo predvidljiva.. ali i pored toga je ooodlična :D",Positive,None,None,None,Positive,None,None
281,"I meni se sviđa, a nisam ženska populacija :)",None,None,None,None,Positive,None,None
282,Nije loš film... hrabro [možda i previše]?,None,None,None,None,Positive,None,None
283,"Pa to da, i sam još faktor što nijedan drugi lik nema nikakvo detaljno objašnjenje osim nadimka... nije vremena uopšte posvećeno drugim članovima bande. MIslim da bi bilo interesantno videti i njihove motive, pa makar na blic, zašto su tako radikalno orijentisani.",None,None,None,None,None,Positive,None
284,"takođe smatram da jednostavno novica prebrzo se preobraća iz antisocialnog genija u vođu grupe navijača i skinhead ekipe... malo mi je glupavo jer nije realno da se niko od onih prethodnih likova, koju su tu mnogo duže od njega, nije pobunio za mesto na tronu nego ga tako olako prepustio!",None,None,None,None,Neutral,None,None
285,"Jeste, tema je generalno sjajna.. jedino nisam zadovoljan ozbiljnošću realizacije!",Positive,Negative,None,None,None,None,None
287,Gospode! Mislila sam da scene sa plakanjem na podu i svađanjem oko krađe pomorandži nemaju kraj. Da ovaj film uopšte nema kraj :) Hajlajt mi je pojavljivanje mog dragog Majdanpeka na tri minuta i muzika.,None,None,None,None,Negative,None,None
288,"mislim da je tako ispalo zbog budžeta i opšte tematike filma, msm to je kod nas još pipavo.. kad je naše društvo oslikano u potpunosti u filmu.. inače tema i zaključci su na mestu :D",Positive,None,None,None,None,None,None
290,"Super je film, iako nije ništa novo.. tj iskombinovani već viđeni fazoni, al ipak je super :D ima par momenata koji su malo veštački i čudni, al šta da se radi... meni se svideo :D eee da.. radnja je malo prebrza, tj Novica malo prebrzo napreduje..",Neutral,None,None,None,Positive,None,None
291,film je neviđena glupost,None,None,None,None,Negative,None,None
292,"Glavna karakteristika Srpskog filma je po meni neuverljivost. Film je jednostavno toliko očigledno fejk, da me je stalno izbacivao iz priče i koliko god ja želeo da mu se prepustim to mi jednostavno nije uspevalo. Kapiram da je dosta uverljiviji, a samim tim i zanimljiviji strancima.",None,None,None,None,Negative,None,None
293,"Šokirati i tako privući pažnju, šok radi šoka. U pravu si ocena 1/10",None,None,None,None,Negative,None,None
294,"Ne znam, meni je delovalo kao da po svaku cenu želi da šokira, a radnja i ti momenti ""rastrojenih srba"" su mi stvarno bili nepotrebni...",Negative,None,None,None,None,None,None
295,"Jako su jeftini i naporni momenti, sve je tako nekako isforsirano, uopšte mi se ne sviđa.",None,None,None,None,Negative,None,None
296,"Film je sačinjen od eksplicitnih scena, sve u pozadini toga je trulo i klimavo.",Negative,None,None,None,None,None,None
301,"Dauni je generalno fantastičan glumac... kad je trezan i voljan da radi! :) Ja inače jako volim neprijatan humor, i ovo je svakako ""my cup of tea""! :) Ali trudeći se da ne budem ""fanboy"", i da dam objektivno mišljenje, smatram da će ga većina teško svariti, a kamoli uživati!",None,None,Positive,None,Neutral,None,None
302,Gluplji i bezvredniji film nisam gledao. Ko ovo naziva filmom i ko ovo hvali neka mu je Bog u pomoći.,None,None,None,None,Negative,None,None
309,odlična je čitava ekipa,None,None,Positive,None,None,None,None
310,Konačno nova lica na ekranu. Izuzetan talenat mladog glumca u ulozi Promaje. Filip... čekam ga u novoj ulozi. Lepo mlado talentovano lice.,None,None,Positive,None,None,None,None
311,"Samo ću da kažem - sjajan film. Ne živim u Srbiji i ne gledam često domaće filmove, a nije da ih nešto gotivim, ali ovaj film je pravo osveženje. Da, ima da se gleda na instant movie Amazon, i ako ste Prime member možete da ga gledate besplatno.",None,None,None,None,Positive,None,None
315,"To da, pohvalio sam ga već na tome što ne pripada klasičnim ostvarenjima naše kinematografije, samo smatram da je ta odlična pozadinska priča mogla imati veći udeo i značaj, dodalo bi dosta na kvalitetu filma.",Neutral,None,None,None,Neutral,None,None
316,"Odličan film, za svaku pohvalu. Ne razumem zašto vam se toliko ne sviđa, očekivali ste holivudsku priču?",None,None,None,None,Positive,Negative,None
319,"Pa ne znam, nije me dovoljno zaintrigirao, pogotovo što su prvih 30 min apsolutno statični. A što se tiče zvuka, vidim da je neka polu-dokumentarac fora, moguće zbog toga!",None,None,None,Neutral,Neutral,None,None
320,"Slažem se... neke sekvence su totalno van fokusa, ali to je taj neki stil dokumentarnog filma, uglavnom, moglo je bolje... ali eto.",None,None,None,None,Neutral,Positive,Neutral
321,"Ok je kamera, iako u par kadrova zna vrlo da iritira (čitaj vrti nas u krug 5x).. a trougao je vrlo slabo naglašen, da se iznelo nešto sem: ""šta si navalio na devojku, smara"" još bi i bilo zapleta",None,None,None,None,None,None,Neutral
322,"Pa taj prozirni zaplet je centriran oko tog trougla, sve ostalo je generalno ""blejanje"". Slažem se sa tobom, baš nekako dijalozi deluju previše izveštačeno, prenaglašeni su i nepotrebni. Ali ono što nisam spomenuo gore, sviđa mi se način snimanja, forsirajući te neke Džarmušovske kadrove...",Negative,None,None,None,None,Positive,Positive
325,"klasičan neo noar. malo mi je bez veze onaj deo kada ON ne uspeva da skonta da ONA nije ubila svog muža već detektiv, nego sve misli da ona njega razume a zapravo ne razume. film je svakako preporuka jedan od top 10 neo noara",None,None,None,None,Positive,None,None
328,Meni je zakon... a još debitantski! :O,None,None,None,None,Positive,None,None
329,meni skroz dobar!,None,None,None,None,Positive,None,None
330,"Meni je dovoljna činjenica da je film poštovanog velikog umetnika Džima Džarmuša, interesovanje je zagarantovano. Način na koji on gradi likove je maestralan, uz zanimljivu priču (priče), to čini uvek nezaboravno iskustvo. Veliko hvala velikom Džimu.",Positive,Positive,None,None,None,None,None
331,Film je zanimljiv najviše zbog toga što su zanimljivi i inteligentni dijalozi na prvom mestu... a to je retkost u filmovima.,None,None,None,None,Positive,None,None
332,"Hvala, i meni je isto omiljeni Rim, ultra brbljivi Benini je uvek urnebesan :)",None,None,Positive,None,Positive,None,None
333,"Rim sam gledala bar 1000 puta i plakala od smeha, a i ostali gradovi su sjajni, ne znam koji mi je bolji. Ipak je Rim... neću da ostavljam spojlere ovde, ali bravo za recenziju.",None,None,None,None,Positive,Positive,None
334,"Zakon, naprosto obožavam.",None,None,None,None,Positive,None,None
335,"Genijalan film... Davno ga nisam gledala, mogla bih opet - pa se javim! ;)",None,None,None,None,Positive,None,None
336,Naravno... samo ću ti još napomenuti da je Tom Waits radio muziku.... može li bolje? :),None,None,None,Positive,None,None,None
338,"Jako je dobro... obavezno, čim vremena uhvatiš!",None,None,None,None,Positive,None,None
339,"hm, ovo baš deluje interesantno. vredi gledati, rekla bih.",None,None,None,None,Positive,None,None
340,Glupost od filma moja ocena je 2/10,None,None,None,None,Negative,None,None
344,A taman sam se ponadala da će ovo biti jedna od onih finih – opuštajućih – ne moram da razmišljam ali ipak simpatičnih komedija. Odustala od gledanja nakon 30 min. Definitivno film za preskočiti.,None,None,None,None,Negative,None,None
